Chapter Number	Chapter Text	Chapter Embedding
7	"VII.
CONCERNING NEW PRINCIPALITIES WHICH ARE ACQUIRED EITHER BY THE ARMS OF
OTHERS OR BY GOOD FORTUNE


Those who solely by good fortune become princes from being private
citizens have little trouble in rising, but much in keeping atop; they
have not any difficulties on the way up, because they fly, but they
have many when they reach the summit. Such are those to whom some state
is given either for money or by the favour of him who bestows it; as
happened to many in Greece, in the cities of Ionia and of the
Hellespont, where princes were made by Darius, in order that they might
hold the cities both for his security and his glory; as also were those
emperors who, by the corruption of the soldiers, from being citizens
came to empire. Such stand simply elevated upon the goodwill and the
fortune of him who has elevated them—two most inconstant and unstable
things. Neither have they the knowledge requisite for the position;
because, unless they are men of great worth and ability, it is not
reasonable to expect that they should know how to command, having
always lived in a private condition; besides, they cannot hold it
because they have not forces which they can keep friendly and faithful.

States that rise unexpectedly, then, like all other things in nature
which are born and grow rapidly, cannot leave their foundations and
correspondencies[1] fixed in such a way that the first storm will not
overthrow them; unless, as is said, those who unexpectedly become
princes are men of so much ability that they know they have to be
prepared at once to hold that which fortune has thrown into their laps,
and that those foundations, which others have laid _before_ they became
princes, they must lay _afterwards_.

 [1] “Le radici e corrispondenze,” their roots (i.e. foundations) and
 correspondencies or relations with other states—a common meaning of
 “correspondence” and “correspondency” in the sixteenth and seventeenth
 centuries.

Concerning these two methods of rising to be a prince by ability or
fortune, I wish to adduce two examples within our own recollection, and
these are Francesco Sforza[2] and Cesare Borgia. Francesco, by proper
means and with great ability, from being a private person rose to be
Duke of Milan, and that which he had acquired with a thousand anxieties
he kept with little trouble. On the other hand, Cesare Borgia, called
by the people Duke Valentino, acquired his state during the ascendancy
of his father, and on its decline he lost it, notwithstanding that he
had taken every measure and done all that ought to be done by a wise
and able man to fix firmly his roots in the states which the arms and
fortunes of others had bestowed on him.

 [2] Francesco Sforza, born 1401, died 1466. He married Bianca Maria
 Visconti, a natural daughter of Filippo Visconti, the Duke of Milan,
 on whose death he procured his own elevation to the duchy. Machiavelli
 was the accredited agent of the Florentine Republic to Cesare Borgia
 (1478-1507) during the transactions which led up to the assassinations
 of the Orsini and Vitelli at Sinigalia, and along with his letters to
 his chiefs in Florence he has left an account, written ten years
 before _The Prince_, of the proceedings of the duke in his
 “Descritione del modo tenuto dal duca Valentino nello ammazzare
 Vitellozzo Vitelli,” etc., a translation of which is appended to the
 present work.

Because, as is stated above, he who has not first laid his foundations
may be able with great ability to lay them afterwards, but they will be
laid with trouble to the architect and danger to the building. If,
therefore, all the steps taken by the duke be considered, it will be
seen that he laid solid foundations for his future power, and I do not
consider it superfluous to discuss them, because I do not know what
better precepts to give a new prince than the example of his actions;
and if his dispositions were of no avail, that was not his fault, but
the extraordinary and extreme malignity of fortune.

Alexander the Sixth, in wishing to aggrandize the duke, his son, had
many immediate and prospective difficulties. Firstly, he did not see
his way to make him master of any state that was not a state of the
Church; and if he was willing to rob the Church he knew that the Duke
of Milan and the Venetians would not consent, because Faenza and Rimini
were already under the protection of the Venetians. Besides this, he
saw the arms of Italy, especially those by which he might have been
assisted, in hands that would fear the aggrandizement of the Pope,
namely, the Orsini and the Colonnesi and their following. It behoved
him, therefore, to upset this state of affairs and embroil the powers,
so as to make himself securely master of part of their states. This was
easy for him to do, because he found the Venetians, moved by other
reasons, inclined to bring back the French into Italy; he would not
only not oppose this, but he would render it more easy by dissolving
the former marriage of King Louis. Therefore the king came into Italy
with the assistance of the Venetians and the consent of Alexander. He
was no sooner in Milan than the Pope had soldiers from him for the
attempt on the Romagna, which yielded to him on the reputation of the
king. The duke, therefore, having acquired the Romagna and beaten the
Colonnesi, while wishing to hold that and to advance further, was
hindered by two things: the one, his forces did not appear loyal to
him, the other, the goodwill of France: that is to say, he feared that
the forces of the Orsini, which he was using, would not stand to him,
that not only might they hinder him from winning more, but might
themselves seize what he had won, and that the king might also do the
same. Of the Orsini he had a warning when, after taking Faenza and
attacking Bologna, he saw them go very unwillingly to that attack. And
as to the king, he learned his mind when he himself, after taking the
Duchy of Urbino, attacked Tuscany, and the king made him desist from
that undertaking; hence the duke decided to depend no more upon the
arms and the luck of others.

For the first thing he weakened the Orsini and Colonnesi parties in
Rome, by gaining to himself all their adherents who were gentlemen,
making them his gentlemen, giving them good pay, and, according to
their rank, honouring them with office and command in such a way that
in a few months all attachment to the factions was destroyed and turned
entirely to the duke. After this he awaited an opportunity to crush the
Orsini, having scattered the adherents of the Colonna house. This came
to him soon and he used it well; for the Orsini, perceiving at length
that the aggrandizement of the duke and the Church was ruin to them,
called a meeting of the Magione in Perugia. From this sprung the
rebellion at Urbino and the tumults in the Romagna, with endless
dangers to the duke, all of which he overcame with the help of the
French. Having restored his authority, not to leave it at risk by
trusting either to the French or other outside forces, he had recourse
to his wiles, and he knew so well how to conceal his mind that, by the
mediation of Signor Pagolo—whom the duke did not fail to secure with
all kinds of attention, giving him money, apparel, and horses—the
Orsini were reconciled, so that their simplicity brought them into his
power at Sinigalia.[3] Having exterminated the leaders, and turned
their partisans into his friends, the duke laid sufficiently good
foundations to his power, having all the Romagna and the Duchy of
Urbino; and the people now beginning to appreciate their prosperity, he
gained them all over to himself. And as this point is worthy of notice,
and to be imitated by others, I am not willing to leave it out.

 [3] Sinigalia, 31st December 1502.

When the duke occupied the Romagna he found it under the rule of weak
masters, who rather plundered their subjects than ruled them, and gave
them more cause for disunion than for union, so that the country was
full of robbery, quarrels, and every kind of violence; and so, wishing
to bring back peace and obedience to authority, he considered it
necessary to give it a good governor. Thereupon he promoted Messer
Ramiro d’Orco,[4] a swift and cruel man, to whom he gave the fullest
power. This man in a short time restored peace and unity with the
greatest success. Afterwards the duke considered that it was not
advisable to confer such excessive authority, for he had no doubt but
that he would become odious, so he set up a court of judgment in the
country, under a most excellent president, wherein all cities had their
advocates. And because he knew that the past severity had caused some
hatred against himself, so, to clear himself in the minds of the
people, and gain them entirely to himself, he desired to show that, if
any cruelty had been practised, it had not originated with him, but in
the natural sternness of the minister. Under this pretence he took
Ramiro, and one morning caused him to be executed and left on the
piazza at Cesena with the block and a bloody knife at his side. The
barbarity of this spectacle caused the people to be at once satisfied
and dismayed.

 [4] Ramiro d’Orco. Ramiro de Lorqua.

But let us return whence we started. I say that the duke, finding
himself now sufficiently powerful and partly secured from immediate
dangers by having armed himself in his own way, and having in a great
measure crushed those forces in his vicinity that could injure him if
he wished to proceed with his conquest, had next to consider France,
for he knew that the king, who too late was aware of his mistake, would
not support him. And from this time he began to seek new alliances and
to temporize with France in the expedition which she was making towards
the kingdom of Naples against the Spaniards who were besieging Gaeta.
It was his intention to secure himself against them, and this he would
have quickly accomplished had Alexander lived.

Such was his line of action as to present affairs. But as to the future
he had to fear, in the first place, that a new successor to the Church
might not be friendly to him and might seek to take from him that which
Alexander had given him, so he decided to act in four ways. Firstly, by
exterminating the families of those lords whom he had despoiled, so as
to take away that pretext from the Pope. Secondly, by winning to
himself all the gentlemen of Rome, so as to be able to curb the Pope
with their aid, as has been observed. Thirdly, by converting the
college more to himself. Fourthly, by acquiring so much power before
the Pope should die that he could by his own measures resist the first
shock. Of these four things, at the death of Alexander, he had
accomplished three. For he had killed as many of the dispossessed lords
as he could lay hands on, and few had escaped; he had won over the
Roman gentlemen, and he had the most numerous party in the college. And
as to any fresh acquisition, he intended to become master of Tuscany,
for he already possessed Perugia and Piombino, and Pisa was under his
protection. And as he had no longer to study France (for the French
were already driven out of the kingdom of Naples by the Spaniards, and
in this way both were compelled to buy his goodwill), he pounced down
upon Pisa. After this, Lucca and Siena yielded at once, partly through
hatred and partly through fear of the Florentines; and the Florentines
would have had no remedy had he continued to prosper, as he was
prospering the year that Alexander died, for he had acquired so much
power and reputation that he would have stood by himself, and no longer
have depended on the luck and the forces of others, but solely on his
own power and ability.

But Alexander died five years after he had first drawn the sword. He
left the duke with the state of Romagna alone consolidated, with the
rest in the air, between two most powerful hostile armies, and sick
unto death. Yet there were in the duke such boldness and ability, and
he knew so well how men are to be won or lost, and so firm were the
foundations which in so short a time he had laid, that if he had not
had those armies on his back, or if he had been in good health, he
would have overcome all difficulties. And it is seen that his
foundations were good, for the Romagna awaited him for more than a
month. In Rome, although but half alive, he remained secure; and whilst
the Baglioni, the Vitelli, and the Orsini might come to Rome, they
could not effect anything against him. If he could not have made Pope
him whom he wished, at least the one whom he did not wish would not
have been elected. But if he had been in sound health at the death of
Alexander,[5] everything would have been different to him. On the day
that Julius the Second[6] was elected, he told me that he had thought
of everything that might occur at the death of his father, and had
provided a remedy for all, except that he had never anticipated that,
when the death did happen, he himself would be on the point to die.

 [5] Alexander VI died of fever, 18th August 1503.

 [6] Julius II was Giuliano della Rovere, Cardinal of San Pietro ad
 Vincula, born 1443, died 1513.

When all the actions of the duke are recalled, I do not know how to
blame him, but rather it appears to be, as I have said, that I ought to
offer him for imitation to all those who, by the fortune or the arms of
others, are raised to government. Because he, having a lofty spirit and
far-reaching aims, could not have regulated his conduct otherwise, and
only the shortness of the life of Alexander and his own sickness
frustrated his designs. Therefore, he who considers it necessary to
secure himself in his new principality, to win friends, to overcome
either by force or fraud, to make himself beloved and feared by the
people, to be followed and revered by the soldiers, to exterminate
those who have power or reason to hurt him, to change the old order of
things for new, to be severe and gracious, magnanimous and liberal, to
destroy a disloyal soldiery and to create new, to maintain friendship
with kings and princes in such a way that they must help him with zeal
and offend with caution, cannot find a more lively example than the
actions of this man.

Only can he be blamed for the election of Julius the Second, in whom he
made a bad choice, because, as is said, not being able to elect a Pope
to his own mind, he could have hindered any other from being elected
Pope; and he ought never to have consented to the election of any
cardinal whom he had injured or who had cause to fear him if they
became pontiffs. For men injure either from fear or hatred. Those whom
he had injured, amongst others, were San Pietro ad Vincula, Colonna,
San Giorgio, and Ascanio.[7] The rest, in becoming Pope, had to fear
him, Rouen and the Spaniards excepted; the latter from their
relationship and obligations, the former from his influence, the
kingdom of France having relations with him. Therefore, above
everything, the duke ought to have created a Spaniard Pope, and,
failing him, he ought to have consented to Rouen and not San Pietro ad
Vincula. He who believes that new benefits will cause great personages
to forget old injuries is deceived. Therefore, the duke erred in his
choice, and it was the cause of his ultimate ruin.

 [7] San Giorgio is Raffaello Riario. Ascanio is Ascanio Sforza."	[0.0026799967, -0.0012363133, 0.02681051, -0.035878565, -0.016392794, 0.031295333, -0.029805077, -0.005630629, -0.03146404, -0.030254966, 0.035203733, 0.010354453, -0.0009973103, 0.02697922, 0.013215459, 0.020062191, 0.04915026, 0.0047660004, 0.018501643, 0.0022529545, -0.0030789208, -0.0061437823, -0.01165491, -0.0025974, -0.0052369772, 0.007191178, 0.023520704, -0.0028803374, 0.020048132, -0.029748842, 0.009890506, 0.018937472, -0.013932467, 0.0035094775, -0.031267215, 0.0063265497, 0.011331553, -0.019542009, -0.0010948445, -0.0017608895, 0.027513461, 0.0040068147, -0.008807963, -0.015689842, -0.035709858, 0.011162845, 0.001582516, -0.008245603, -0.004270421, 0.006263284, 0.029439544, 0.030873561, -0.03315112, 0.0028012556, 0.002521833, -0.0015385817, -0.009637443, 0.017658103, -0.023815945, 0.008210455, 0.033488534, 0.022016393, 0.008561931, 0.0036412806, -0.03748129, 0.00018232764, -0.029748842, -0.0134333735, -0.032673113, -0.019570127, 0.044004668, 0.023267644, -0.0067869816, -0.0067026275, 0.021060381, -0.014565122, -0.029158363, 0.004119287, -0.030254966, 0.00013982113, -0.011162845, -0.020005954, -0.031323448, -0.008329957, 0.005374052, -0.013742671, -0.005852058, 0.03272935, -0.015352427, -0.0075004757, -0.0006484713, 0.021833625, 0.025067195, -0.0045972927, -0.015352427, -0.0077746264, -0.021988275, -0.0030209273, -0.0098061515, -0.021833625, -0.004203641, 0.00491362, -0.04153028, -0.0061719003, -0.01361614, -0.021439973, -0.009855358, -0.022227278, 0.015324309, -0.024884427, -0.0037678117, 0.027963348, 0.015183719, -0.032082636, 0.030929798, -0.028103938, 0.02010437, -0.0015060703, 0.016800504, -0.008913405, -0.0021106072, 0.01599914, -0.005953986, -0.0017916437, 0.0207792, -0.006829159, 0.0038591952, 0.0033882188, -0.010649691, -0.012329742, 0.006403874, -0.014333149, 0.0150571875, -0.0064636245, 0.012596863, 0.004157949, -0.016280321, -0.02259281, -0.014009792, -0.04451079, 0.032898057, 0.013658318, -0.004857384, -0.004115772, -0.0028856094, 0.023351997, -0.0031421862, -0.010059213, 0.004857384, 0.0017547387, 0.03523185, -0.018543819, 0.017517513, -0.01657556, 0.022114806, 0.007570771, -0.014494828, 0.029158363, -0.011781441, -0.014846303, 0.0028276162, 0.020020014, 0.0053143017, 0.0034374252, 0.012055592, 0.025376493, 0.010157627, 0.016547441, -0.004326657, -0.004688676, 0.0051034167, 0.010466925, -0.03565362, 0.024659485, 0.012702306, 0.016378734, 0.0097288275, 0.0131662525, -0.02991755, -0.0071982075, 0.002743262, 0.0045445715, 0.056067288, 0.030423673, -0.018487584, -0.011844707, 0.018178286, 0.008540842, 0.001172169, -0.006614759, -0.009785064, 0.028160175, -0.007985511, -0.0057641896, -0.6284935, -0.01557737, -0.015380545, -0.012589834, 0.0090047885, 0.015099364, -0.00064144185, 0.011183933, -0.016280321, 0.010748104, -0.028357001, 0.01431909, 0.003027957, 0.004017359, -0.02740099, -0.024518894, 0.023548823, -0.01192906, 0.012006385, 0.001239828, -0.006235166, 0.013313872, 0.0059469566, 0.00982724, 0.013602082, 0.013496639, 0.016449029, -0.014094146, 0.008597078, 0.008765786, -0.018023636, 0.015900727, -0.0020789744, 0.0033021073, 0.04200829, -0.013405255, -0.029523898, 0.031126624, 0.021397796, 0.011444025, -0.023787826, -0.015338368, 0.010052185, 0.012154005, 0.0038978574, -0.0043372014, 0.003418094, -0.004604322, -0.003968152, 0.015816374, 0.014305031, 0.0024234198, -0.005493554, -0.009229733, -0.0009788577, -0.003520022, 0.022381926, -0.013714554, 0.0044285846, 0.0014937687, 0.011436995, 0.010783252, -0.018220462, -0.014087116, 0.00940547, 0.016364675, 0.0021562988, 0.0137215825, 0.033066764, -0.0036588544, -0.008463517, 0.018571937, -0.013039721, -0.018937472, -0.0015974537, -0.014832243, 0.022114806, 0.01923271, 0.002715144, 0.008442429, -0.009447647, -0.0014594998, -0.019049942, 0.020413667, 0.009925653, 0.011542438, -0.040461797, 0.014508887, -0.016505264, -0.0047660004, 0.00091998576, 0.010438806, -0.004713279, -0.012807748, 0.015605489, 0.025756085, -0.0038310771, -0.0026940557, 0.010080302, -0.021018203, -0.009630414, -0.007514535, 0.0034936613, -0.0015438538, 0.029973786, -0.006614759, 0.0027063573, 0.00058256974, 0.04855978, -0.059610154, 0.009595267, 0.0102068335, 0.009222703, 0.0036061332, 0.016364675, -0.027569696, 0.016505264, -0.015310249, -0.008308868, -0.02794929, 0.013819996, 0.017053565, -0.016603678, -0.033769716, 0.00052940915, 0.041333456, -0.008301839, -0.018782822, -0.0139113795, 0.004692191, 0.013236548, -0.015282132, 0.042626884, 0.0036904872, 0.020610493, -0.021974215, -0.0052334624, 0.015914787, 0.018459465, -0.018318875, -0.0018083387, -0.010698898, 0.029383307, -0.021060381, -0.003117583, -0.03748129, -0.012969427, -0.006825644, -0.044876326, 0.0025745542, 0.008119072, -0.024617307, -0.028202351, 0.00042945848, 0.0040208735, 0.0048116925, -0.0014445621, 0.0060453694, 0.0022758003, -0.0067764376, 0.008829052, 0.022227278, -0.05224324, 0.010586426, 0.0069170273, -0.0165615, -0.00041781587, 0.016322497, 0.006470654, -0.047266353, 0.0036447954, 0.0041017127, -0.0020983056, 0.026023207, -0.014663536, 0.014199588, -0.030986033, 0.0031755765, 0.0045199683, 0.022424104, 0.004660558, -0.037734352, -0.023112994, -0.0123648895, 0.0058485437, -0.0038591952, 0.015366485, 0.0038170181, 0.009454677, 0.013925439, -0.023956534, -0.0122313285, 0.0028803374, -0.014958775, 0.0003622389, 0.000552255, 0.029467661, 0.025657672, 7.007532e-05, 0.012146975, 0.02219916, -0.0014489556, 0.036834575, -0.023759708, 0.0012828837, -0.040771097, 0.003314409, -0.00491362, 0.025376493, 0.0023285216, -0.0059188385, -0.015872609, -0.0077324496, -0.036750223, 0.009496854, 0.041614637, 0.03160463, 0.0029559045, -0.0038451361, -0.0033882188, 0.0009814939, -0.013834055, 0.0131100165, -0.009609326, -0.018487584, -0.0057220124, 0.0055708783, -0.021383736, -0.0025130461, -0.024673542, -0.02752752, 0.014361267, 0.023492588, -0.0045516007, 0.0093281455, 0.02807582, 0.005208859, -0.0055708783, 0.014593241, -0.022902109, 0.0147338305, 0.0021861743, 0.0037642969, 0.015942905, 0.008140161, -0.011746294, 0.02613568, 0.009363294, -0.007816804, 0.030367438, 0.018895295, -0.0030244421, 0.009602296, 0.018206403, 0.008231544, -0.037874945, 0.009749915, 0.022058569, 0.008147189, 0.010867606, 0.0016510537, -0.00603834, 0.006330064, -0.009567149, 0.020469902, -0.00013685557, 0.009925653, -0.0015587915, -0.03090168, -0.023070818, -0.0196826, 0.005760675, 0.012969427, 0.0077113607, 0.016055377, -0.0087939035, -0.0071243974, -0.038830955, 0.02529214, 0.011865795, -0.03846542, -0.025221843, 0.027077632, 0.024476716, 0.014635418, -0.024167418, -0.027907113, 0.0097288275, -0.01782681, 0.01657556, -0.020062191, -0.016969211, -0.013679406, -0.026191914, -0.007388004, -0.018445406, 0.0008470547, -0.014234737, 0.02091979, -0.01824858, 0.024673542, -0.01768622, 0.000875612, 0.01109255, 0.036159746, 0.0039540934, -0.0038732542, -0.012660128, -0.032166988, -0.018965589, -0.014494828, -0.008372134, -0.027485343, -0.011113639, 0.016884858, 0.013257636, -0.021960156, 0.0038521658, 0.025432728, -0.01138076, 0.014276913, -0.025264021, -0.011050373, -0.0009226218, 0.115508735, 0.034050897, -0.012617951, -0.0013637228, -0.0013795393, 0.008400252, -0.0047695152, -0.033460416, 0.030198729, -0.0026782393, 0.008646284, -0.014016822, 0.0196826, 0.016111612, 0.02596697, -0.00035630775, 0.0063827853, -0.009384382, 0.002850462, -0.010825429, 0.00050919934, 0.010755134, 0.017911164, 0.021004144, -0.007816804, 0.0074161217, 0.034332074, 0.02021684, 0.005588452, 0.0011976509, -0.025221843, 0.002207263, 0.024462657, 0.019007767, -0.024940664, -0.020230899, -0.0024128756, 0.029833196, -0.0036588544, -0.02262093, 0.018206403, 0.018276699, 0.012913191, -0.018923413, 0.0053178165, -0.014347209, -0.017320687, -0.0076832427, -0.0032300549, -0.01306784, 0.02176333, -0.012104798, -0.003792415, -0.012189152, 0.021397796, 0.0033530712, 0.010291187, -0.0032652025, -0.018881235, 0.032251343, -0.028160175, -0.030929798, 0.0035182645, -0.008618167, -0.003249386, -0.041052278, -0.0045410567, -0.008667373, -0.031942043, -0.010066243, -0.00347433, -0.013841084, -0.02160868, -0.001917296, 0.031014152, 0.023506645, -0.003103524, -0.0023812428, 0.020582374, -0.00885014, -6.062943e-05, -0.045719866, 0.008772816, -0.028750652, -0.002926029, 0.005953986, -0.022142923, -0.009672591, 0.001832942, 0.006263284, -0.008540842, 0.01571796, -0.004323142, -0.0047835745, 0.006474169, 0.0027678653, -0.0023619118, 0.00040705194, -0.00030534388, -0.021946097, 0.0049663414, -0.015633607, -0.010480983, -0.010270098, 0.020202782, 0.01432612, -0.0022670135, -0.01516966, -0.023984652, -0.016969211, -0.0051139607, -0.020244958, 0.0050506955, -0.0031070388, -0.026740216, 0.0072685024, 0.0137215825, 0.023970593, 0.012006385, -0.008646284, -0.007781656, -0.0026993277, 0.02430801, 0.012435185, -0.04524186, 0.007880068, -0.005953986, -0.009637443, -0.03115474, 0.008463517, -0.00041342244, 0.014108205, 0.008224514, -0.013004574, -0.031098505, -0.009714768, -0.011612733, -0.016392794, -0.035091262, 0.012955368, -0.0019331124, -0.0049979743, -0.0040665655, -0.028581945, -0.00031566847, -0.026248151, -0.006330064, -0.007047073, 0.0062140776, 0.0033495564, -0.016252203, -0.031660866, -0.021468092, -0.017461276, 0.026177855, -0.033854067, 2.2008375e-05, -0.038381066, 0.01657556, -0.0052053444, 0.030086257, 0.0039927554, 0.009925653, 0.025531141, -0.019809129, 0.0076762135, -0.02262093, -0.013735642, -0.02821641, 0.014298002, 0.02203045, 0.021833625, -0.0057431012, -0.023576941, 0.002760836, 0.04439832, 0.000633973, -0.023900298, -0.028511649, -0.044004668, -0.00477303, -0.013412285, -0.005082328, -0.008632225, -0.0045269975, -0.006305461, 0.03894343, 0.0009454677, -0.014066028, -0.003047288, 0.018304817, -0.005641173, 0.031660866, 0.010937901, 0.016547441, 0.004495365, 0.0066112443, 0.013812967, 0.0016598406, 0.017109802, -0.027569696, 0.018417288, -0.021383736, -0.007964423, -0.01109958, 0.007289591, 0.015507076, -0.020230899, 0.026585566, -0.014094146, -0.0007134942, -0.013946527, -3.564176e-05, -0.024392363, -0.0076762135, -0.002448023, -0.0008329957, 0.003933005, -0.023928417, -0.040489916, -0.006442536, -0.0075075054, 0.054548915, 0.00033521926, 0.01798146, -0.009693679, -0.006569067, -0.0068221292, 0.0054794946, 0.016547441, -0.007851951, 0.017995518, 0.017939283, -0.01684268, 0.005008518, 7.386466e-05, -0.0024691117, -0.03455702, -0.010649691, 0.054605152, 0.031520274, 0.01137373, -0.013081898, -0.008955582, -0.0023742134, 0.0072544436, -0.01474789, 0.008315898, -0.01264607, -0.0025534655, -0.009714768, 0.0047624856, -0.024504835, 0.020329311, 0.008618167, -0.017489394, -0.009904564, -0.01599914, -0.00787304, 0.026487153, -0.023112994, 0.019120239, 0.013032692, 0.0017274995, 0.0020350402, 0.008168278, -0.00077324494, -0.00042704208, -0.01725039, 0.025095314, -0.02076514, -0.0014735588, -0.00085803826, 0.008765786, -0.011429966, 0.00073414337, 0.0077113607, -0.0010632118, 0.009110231, 0.0062562544, 0.007004896, 0.013440403, 0.0024163905, -0.005785278, 0.0022002333, -0.010361482, 0.008105013, 0.009300028, -0.004119287, 0.004031418, -0.02487037, -0.025503024, 0.00019023583, 0.0059153237, 0.005184256, -0.0074442397, -0.014691654, 0.01067781, 0.0036588544, 0.02037149, -0.01235083, -0.006024281, -0.0072333547, 0.019781012, 0.0005513764, 0.013580993, 0.042879947, -0.013018633, 0.002465597, 0.009377352, 0.005307272, 0.010593455, 0.011275317, -0.004298539, 0.012083709, 0.008639255, -0.0014779522, -0.007753538, -0.01038257, -0.015689842, 0.021664917, 0.015408663, -0.0050260923, -0.024547013, 0.016673973, 0.0069346013, 0.015141542, 0.009700709, -0.025362434, -0.010347423, -0.004031418, -0.013306842, -0.017222274, -0.0059047793, -0.0028592488, -8.498555e-06, -0.010375541, 0.01698327, -0.005124505, -0.015858551, 0.029270835, 0.01348961, 0.014902539, -0.0060770023, -2.0099975e-05, -0.018473525, 0.014466709, 0.00038310772, -0.029017774, -0.0017934011, -0.014220677, 0.047688123, 0.0055111274, -0.016364675, -0.0033407696, 0.0034655433, -0.031323448, -0.010059213, -0.00067922537, 0.03146404, 0.04057427, -0.0006511074, -0.0018839058, 0.00653392, -0.0073950333, -0.0017125618, -0.0055568195, -0.0165615, -0.014438592, -0.0031439436, -0.0029892947, 0.013468521, -0.04001191, 0.0032792615, 0.010579397, -0.008857169, 0.008336986, 0.012428155, -0.003061347, 0.0010131266, -0.013004574, -0.003412822, 0.020230899, 0.024982842, 0.020287136, -0.061297234, 0.0103896, -0.00053731736, 0.02529214, -0.01571796, 0.0045305123, -0.0018540304, -0.0063827853, 0.016786445, -0.0069732633, 0.012568745, 0.029355189, -0.009307058, 0.041614637, -5.1375755e-05, 0.0013610868, -0.0018241551, -0.0018768763, -0.0013461491, -0.024097124, 0.00301917, 0.016350616, -0.012793689, 0.0063687265, -0.017883046, 0.009068054, -0.008618167, 0.015886668, -0.025488965, -0.007345827, -0.0047308533, 0.017334746, -0.005869632, 0.0077465083, 0.042598765, -0.02415336, 0.0018136109, -0.008800933, 0.00084661535, -0.018234521, -0.025474906, -0.010544249, 0.010930872, -0.0033407696, 0.0006124451, 2.8941768e-05, -0.010797311, -0.01194312, 0.0027731375, -0.0071243974, -0.012463302, 0.21774578, 0.009046965, 0.0015790013, 0.020554256, 0.0025183181, -0.011837677, -0.00020121942, -0.0090047885, -0.0057220124, 0.019865366, -0.005725527, 0.017236333, -0.01867035, 0.0072614728, 0.017151978, -0.019907542, -0.02388624, -0.028989656, 0.009201615, -0.004242303, 0.009103201, -0.0031808484, -0.009475765, -0.014424533, 0.02401277, 0.0024902, -0.017503453, 0.009616355, 0.022058569, 0.002493715, 0.00072403846, 0.008315898, 0.024054946, 0.016378734, -0.034247722, 0.003426881, 0.022677165, 0.0019946205, -0.0023953018, -0.010087332, 0.025109371, -0.0028627636, 0.0012714607, -0.019809129, 0.017728398, 0.050218742, -0.018304817, -0.0069873226, -0.039224606, -0.0033126515, -0.036862694, 0.004242303, 0.015788255, 0.023759708, 0.011612733, 0.0046394696, 0.006024281, 0.029130245, -0.013278725, -0.0043372014, 8.512285e-05, 0.020652669, -0.005634144, 0.021397796, -0.0040525063, 0.036244098, -0.011057403, -0.016688032, 0.00038903885, -0.021678977, -0.0115635265, -0.023337938, -0.004678132, 0.0024849281, -0.0039927554, -0.01122611, 0.034894437, -0.0028557342, -0.001495526, -0.020315254, 0.0067272307, -0.022283513, -0.005588452, -0.007047073, -0.017812751, -0.031210978, 0.016252203, -0.007788685, -0.03944955, -0.0008975792, -0.012245388, -0.026487153, -0.0033372547, 0.005430288, 0.013222489, -0.020821378, 0.0013769032, 0.02863818, 0.00079872686, -0.00547598, -0.019598244, 0.044595145, 0.023380116, -0.00926488, -0.025770145, -0.00189445, 0.009187556, 0.03365724, 0.01965448, -0.004382893, -0.0066604507, -0.0025956426, 0.0017529815, -0.022719342, 0.03779059, 0.0033372547, 0.011872824, -0.02118691, 0.01318734, 0.009384382, 0.00036707168, -0.014691654, 0.012428155, 0.010600485, -0.0017749486, -0.020048132, -0.042879947, 0.021439973, 0.017292568, -0.010417718, 0.035091262, -0.027822759, 0.016814563, 0.007795715, -0.008126101, -0.0062175924, 0.013222489, -0.020048132, 0.021411855, -0.01318734, 0.0013962343, 0.004467247, 0.03607539, 0.015760137, 0.006681539, -0.010241981, -0.0009999463, -0.03149216, -0.003933005, -0.01502907, -0.009117261, 0.010727016, 0.011183933, -0.022789637, -0.0011458084, -0.008625195, -0.023408232, -0.03849354, 0.01699733, 0.02821641, -0.028553827, 0.021974215, 0.021847684, -0.020610493, -0.016800504, -0.026726156, -0.18107991, 0.037284464, 0.027921172, -0.0022529545, 0.015942905, 2.8722096e-05, 0.03033932, -0.0016343587, 0.0007257958, -0.02262093, 0.021074438, 0.011303435, -0.012716364, -0.02668398, -0.008231544, -0.0018294272, -0.031098505, 0.0028838522, 0.026937041, 0.015703902, 0.01910618, -0.014333149, 0.0060137366, -0.025151549, 0.01951389, -0.008519753, 0.0032036942, -0.0050928723, -0.0035938316, -0.036469042, 0.0037045463, -0.006980293, 0.03523185, -0.0018487583, -0.003778356, 0.00442507, 0.0006440779, 0.005374052, 0.012786659, 0.020624552, 0.03576609, 0.0074372105, 0.016673973, -0.006562038, -0.0035235365, 0.02679645, 0.010832459, -0.02612162, 0.03047991, -0.019120239, 0.00505421, 0.0028627636, 0.0123648895, 0.015985081, 0.021510268, 0.010881665, -0.021861743, 0.0065655527, 0.002442751, 9.013411e-06, -0.009103201, 0.0052404916, 0.026740216, 0.0015693357, -0.003516507, -0.017095743, -0.013791878, 0.029692605, -0.025348375, 0.01923271, -0.0081823375, -0.0030771634, 0.012322713, -0.011359671, 0.005321331, 0.0021035776, -0.023155171, 0.00059355336, -0.017883046, 0.009370322, -0.032166988, 0.017714338, 0.00491362, -0.024842251, -0.008470546, 0.01573202, 0.0058379993, -0.0016264505, -0.003412822, -0.003534081, -0.016125672, -0.02091979, -0.009862388, 0.002757321, 0.006540949, 0.019991897, 0.021046322, -0.003679943, -0.0071138535, -0.023380116, 0.0058063664, -0.00077148754, -0.03638469, 0.011957179, 0.008365104, -0.0087939035, 0.013890291, 0.010410689, 0.050415568, -0.022142923, 0.024406422, 0.01642091, 0.008583019, 0.010459895, -0.0051034167, 0.022241335, -0.005015548, -0.0061543267, 0.015197778, -0.017475335, 0.05435209, -0.018853117, 0.032251343, 0.012674187, -0.00020374564, -0.015394604, -0.12799312, -0.0019963777, 0.010445836, 0.029102128, -0.0015790013, 0.0057923077, -0.00052721245, -0.007317709, -0.028300764, 0.019584185, 0.006119179, -0.046844583, 0.011345612, 0.021411855, 0.0063370937, -0.009377352, 0.014480769, -0.006713172, -0.010431777, 0.02697922, -0.021749271, -0.00652689, 0.0005584059, -0.024757897, 0.0015552767, -0.0045480863, -0.032785587, -0.005514642, 0.015254014, 0.012132916, 0.02457513, 0.00730365, 0.0150571875, -0.0041649784, 0.0047589713, -0.012948338, 0.0040665655, 0.0025569804, 0.003187878, -0.01067078, 0.020596433, 0.005096387, -0.002504259, -0.031520274, 0.0031949074, 0.0047660004, -0.030367438, -0.0072614728, 0.022902109, -0.023745649, -0.025615497, -0.026234092, -0.010628603, 0.0029453603, 0.023281703, -0.029242717, 0.005307272, 0.022016393, -5.5439687e-05, -0.008301839, 0.008547871, 0.01194312, -0.025910735, -0.00014564244, 0.010593455, -0.017334746, -0.019752894, -0.020259017, 0.0013373622, -0.017629985, -0.014333149, 0.001470044, -0.018881235, 0.012505479, -0.028849065, -0.011078491, -0.018459465, -0.01615379, 0.03033932, -0.03450078, -0.010129509, -0.012983485, 0.042767473, -0.03444455, 0.025039077, 0.017194156, 0.021439973, 0.0025815836, 0.0075075054, -0.012491421, -0.019598244, -0.016055377, 0.033516653, -0.020020014, -0.01557737, 0.017517513, 0.033376064, 0.0024743837, 0.0036131628, 0.028174233, -0.023815945, -0.013306842, -0.04633846, 0.030367438, -0.010902754, -0.015914787, -0.0022758003, -0.016041318, -0.0018100961, -0.020146545, -0.018656291, 0.004295024, -0.01109255, 0.026599625, -0.017137919, -0.013609111, -0.018726587, -0.0031966649, 0.018853117, -0.0039505786, -0.0057395864, 0.02470166, -0.00200165, 0.012111828, 0.017151978, 0.0007908187, -0.0024515379, 0.029439544, 0.0041087423, 0.0292146, -0.0035551693, -0.025488965, 0.009637443, -0.031548392, -0.007627007, 0.012280536, -0.005349449, -0.02596697, -0.00709628, 0.006642877, 0.01727851, 0.059328973, -0.013159223, -0.03323547, 3.6108562e-05, -0.024040887, 0.007103309, 0.010832459, -0.00828778, 0.025952911, -0.010192774, -0.0006713172, -3.962331e-05, 0.021454033, -0.012547657, -0.008878258, -0.02429395, -0.02443454, 0.012575774, 0.0030683766, -0.008969641, -0.04074298, 0.02316923, 0.0061437823, 0.0102068335, -0.006625303, 0.016927034, -0.02879283, -0.03365724, 0.014776008, 0.0013487852, -0.020540196, -0.010867606, -0.005451377, 0.00088879233, 0.0011212052, 0.0069662337, 0.007971453, 0.022213219, -0.01657556, -0.022241335, 0.0292146, 0.0053248457, -0.019064002, 0.008315898, 0.024645425, 0.027836818, -0.0069064833, 0.008695491, 0.031773336, -0.009180526, 0.022480339, 0.038381066, 0.015380545, -0.012575774, -0.036440924, -0.015113424, -0.0013048508, -0.018206403, 0.019485772, 0.026318446, 0.013152193, -0.009082113, 0.004973371, 0.0061719003, -0.03033932, 0.005451377, 0.017629985, -0.029692605, -0.034360193, 0.00702247, 0.016195966, 0.008400252, 0.013953556, 0.02190392, 0.0117955, -0.010459895, 0.013496639, 0.0025534655, -0.01994972, -0.012540627, 0.019471714, 0.022114806, -0.0013347262, 0.024771957, 0.0055919667, -0.015521134, 0.01698327, 0.0010140053, -0.019021826, 0.0005548911, 0.0035411103, 0.014382356, 7.930154e-05, -0.025784204, -0.014846303, -0.002446266, -0.027147926, -0.008456488, 0.0004099077, -0.0090610245, 0.043386072, 0.020568315, -0.0055638487, -0.002808285, 0.0014067786, 0.046254106, -0.009173497, -0.0059223534, 0.0014436834, -0.025587378, -0.0020367973, 0.003908402, 0.033432297, -0.022958346, -0.02598103, 0.04985321, -0.014094146, 0.010459895, -0.026037266, 0.00078159245, 0.027147926, 0.010691868, 0.018993707, -0.00245681, -0.030114375, -0.021496208, 0.02949578, 0.011570556, -0.0142558245, -0.014150382, 0.013524757, 0.01573202, -0.03396654, -0.018431347, 0.011205022, -0.017348805, -0.015254014, 0.0027485343, 0.001155474, 0.018332934, -0.013229518, 0.0020561286, -0.019120239, -0.028469473, 0.028961537, 0.0019928631, -0.010734046, -0.0023988166, -0.014579182]
