Chapter Number	Chapter Text	Chapter Embedding
20	"XX.
ARE FORTRESSES, AND MANY OTHER THINGS TO WHICH PRINCES OFTEN RESORT,
ADVANTAGEOUS OR HURTFUL?


1. Some princes, so as to hold securely the state, have disarmed their
subjects; others have kept their subject towns distracted by factions;
others have fostered enmities against themselves; others have laid
themselves out to gain over those whom they distrusted in the beginning
of their governments; some have built fortresses; some have overthrown
and destroyed them. And although one cannot give a final judgment on
all of these things unless one possesses the particulars of those
states in which a decision has to be made, nevertheless I will speak as
comprehensively as the matter of itself will admit.

2. There never was a new prince who has disarmed his subjects; rather
when he has found them disarmed he has always armed them, because, by
arming them, those arms become yours, those men who were distrusted
become faithful, and those who were faithful are kept so, and your
subjects become your adherents. And whereas all subjects cannot be
armed, yet when those whom you do arm are benefited, the others can be
handled more freely, and this difference in their treatment, which they
quite understand, makes the former your dependents, and the latter,
considering it to be necessary that those who have the most danger and
service should have the most reward, excuse you. But when you disarm
them, you at once offend them by showing that you distrust them, either
for cowardice or for want of loyalty, and either of these opinions
breeds hatred against you. And because you cannot remain unarmed, it
follows that you turn to mercenaries, which are of the character
already shown; even if they should be good they would not be sufficient
to defend you against powerful enemies and distrusted subjects.
Therefore, as I have said, a new prince in a new principality has
always distributed arms. Histories are full of examples. But when a
prince acquires a new state, which he adds as a province to his old
one, then it is necessary to disarm the men of that state, except those
who have been his adherents in acquiring it; and these again, with time
and opportunity, should be rendered soft and effeminate; and matters
should be managed in such a way that all the armed men in the state
shall be your own soldiers who in your old state were living near you.

3. Our forefathers, and those who were reckoned wise, were accustomed
to say that it was necessary to hold Pistoia by factions and Pisa by
fortresses; and with this idea they fostered quarrels in some of their
tributary towns so as to keep possession of them the more easily. This
may have been well enough in those times when Italy was in a way
balanced, but I do not believe that it can be accepted as a precept for
to-day, because I do not believe that factions can ever be of use;
rather it is certain that when the enemy comes upon you in divided
cities you are quickly lost, because the weakest party will always
assist the outside forces and the other will not be able to resist. The
Venetians, moved, as I believe, by the above reasons, fostered the
Guelph and Ghibelline factions in their tributary cities; and although
they never allowed them to come to bloodshed, yet they nursed these
disputes amongst them, so that the citizens, distracted by their
differences, should not unite against them. Which, as we saw, did not
afterwards turn out as expected, because, after the rout at Vaila, one
party at once took courage and seized the state. Such methods argue,
therefore, weakness in the prince, because these factions will never be
permitted in a vigorous principality; such methods for enabling one the
more easily to manage subjects are only useful in times of peace, but
if war comes this policy proves fallacious.

4. Without doubt princes become great when they overcome the
difficulties and obstacles by which they are confronted, and therefore
fortune, especially when she desires to make a new prince great, who
has a greater necessity to earn renown than an hereditary one, causes
enemies to arise and form designs against him, in order that he may
have the opportunity of overcoming them, and by them to mount higher,
as by a ladder which his enemies have raised. For this reason many
consider that a wise prince, when he has the opportunity, ought with
craft to foster some animosity against himself, so that, having crushed
it, his renown may rise higher.

5. Princes, especially new ones, have found more fidelity and
assistance in those men who in the beginning of their rule were
distrusted than among those who in the beginning were trusted. Pandolfo
Petrucci, Prince of Siena, ruled his state more by those who had been
distrusted than by others. But on this question one cannot speak
generally, for it varies so much with the individual; I will only say
this, that those men who at the commencement of a princedom have been
hostile, if they are of a description to need assistance to support
themselves, can always be gained over with the greatest ease, and they
will be tightly held to serve the prince with fidelity, inasmuch as
they know it to be very necessary for them to cancel by deeds the bad
impression which he had formed of them; and thus the prince always
extracts more profit from them than from those who, serving him in too
much security, may neglect his affairs. And since the matter demands
it, I must not fail to warn a prince, who by means of secret favours
has acquired a new state, that he must well consider the reasons which
induced those to favour him who did so; and if it be not a natural
affection towards him, but only discontent with their government, then
he will only keep them friendly with great trouble and difficulty, for
it will be impossible to satisfy them. And weighing well the reasons
for this in those examples which can be taken from ancient and modern
affairs, we shall find that it is easier for the prince to make friends
of those men who were contented under the former government, and are
therefore his enemies, than of those who, being discontented with it,
were favourable to him and encouraged him to seize it.

6. It has been a custom with princes, in order to hold their states
more securely, to build fortresses that may serve as a bridle and bit
to those who might design to work against them, and as a place of
refuge from a first attack. I praise this system because it has been
made use of formerly. Notwithstanding that, Messer Nicolo Vitelli in
our times has been seen to demolish two fortresses in Citta di Castello
so that he might keep that state; Guido Ubaldo, Duke of Urbino, on
returning to his dominion, whence he had been driven by Cesare Borgia,
razed to the foundations all the fortresses in that province, and
considered that without them it would be more difficult to lose it; the
Bentivogli returning to Bologna came to a similar decision. Fortresses,
therefore, are useful or not according to circumstances; if they do you
good in one way they injure you in another. And this question can be
reasoned thus: the prince who has more to fear from the people than
from foreigners ought to build fortresses, but he who has more to fear
from foreigners than from the people ought to leave them alone. The
castle of Milan, built by Francesco Sforza, has made, and will make,
more trouble for the house of Sforza than any other disorder in the
state. For this reason the best possible fortress is—not to be hated by
the people, because, although you may hold the fortresses, yet they
will not save you if the people hate you, for there will never be
wanting foreigners to assist a people who have taken arms against you.
It has not been seen in our times that such fortresses have been of use
to any prince, unless to the Countess of Forli,[1] when the Count
Girolamo, her consort, was killed; for by that means she was able to
withstand the popular attack and wait for assistance from Milan, and
thus recover her state; and the posture of affairs was such at that
time that the foreigners could not assist the people. But fortresses
were of little value to her afterwards when Cesare Borgia attacked her,
and when the people, her enemy, were allied with foreigners. Therefore,
it would have been safer for her, both then and before, not to have
been hated by the people than to have had the fortresses. All these
things considered then, I shall praise him who builds fortresses as
well as him who does not, and I shall blame whoever, trusting in them,
cares little about being hated by the people.

 [1] Catherine Sforza, a daughter of Galeazzo Sforza and Lucrezia
 Landriani, born 1463, died 1509. It was to the Countess of Forli that
 Machiavelli was sent as envoy on 1499. A letter from Fortunati to the
 countess announces the appointment: “I have been with the signori,”
 wrote Fortunati, “to learn whom they would send and when. They tell me
 that Nicolo Machiavelli, a learned young Florentine noble, secretary
 to my Lords of the Ten, is to leave with me at once.” _Cf_. “Catherine
 Sforza,” by Count Pasolini, translated by P. Sylvester, 1898."	[-0.0074785464, 0.0002929963, 0.020081282, -0.0247069, 0.007949417, 0.023169644, -0.014119218, 0.008932708, -0.013613724, -0.042489223, 0.027781414, 0.010186057, 0.0016264106, 0.015289472, 0.0053734737, 0.022601828, 0.04910912, 0.006761852, 0.0143892765, -0.025607096, 0.009902149, -0.009472826, 5.912942e-05, -0.0139391795, -0.015552606, 7.297858e-05, 0.038002092, -0.015012489, 0.014901696, -0.020012036, 0.0077693784, -0.001105336, -0.0032355099, 0.0072915824, -0.04268311, -0.005131114, 0.006540266, -0.019748902, 0.006567964, -0.0132259475, 0.034152027, 0.0189595, -0.008510308, -0.0012161293, -0.01746379, 0.014049972, 0.0020600625, 0.009562844, -0.010317624, -0.00408204, 0.041492082, 0.019541165, -0.023308136, 0.00940358, -0.0008781233, -0.016715936, -0.021355404, 0.025648644, -0.013080532, -0.0036561782, 0.020233622, 0.020178225, -0.009819054, 0.004518288, -0.029637203, -0.00025274715, -0.028612364, 0.012180336, -0.018557874, -0.01927803, 0.03381965, 0.03675567, 0.00815023, 0.00091317896, 0.022961907, -0.014749355, -0.024097538, 0.0119864475, -0.028584667, 0.005484267, -0.0136068, -0.025884079, -0.04010717, -0.013412911, 0.010012942, 0.0006279728, 0.005124189, 0.032767113, -0.011335537, -0.0015320632, -0.010144509, 0.024125237, 0.011771786, 0.002723091, -0.026715029, 0.0027161664, -0.026424197, -0.009611317, 0.004992622, -0.0014861879, 0.014721657, 0.01564955, -0.03282251, -0.0048402813, -0.008662649, -0.009548996, -0.01697907, -0.021036875, -0.010421493, -0.02916633, -0.012298054, 0.030578945, 0.0029290973, -0.047530316, 0.024166783, -0.025496302, 0.010753873, -0.0057023917, 0.022006314, -0.0043244003, 0.013523704, 0.01244347, 0.011889503, 0.0029342908, 0.037503526, -0.014444673, 0.008801141, 0.006675295, -0.032711715, -0.018640969, 0.012000297, -0.0074854707, 0.020399813, -0.016023478, -0.008378741, 0.0017363384, -0.014250785, -0.018239344, -0.005885893, -0.04138129, 0.03827908, 0.015704947, -0.0058928174, -0.0074093007, -0.0027386714, 0.019014897, -0.0022868426, -0.008988105, -0.008067136, -0.0011754475, 0.028266136, 0.004217069, 0.015358718, 0.0080255885, 0.0008171004, 0.021355404, -0.029637203, 0.016674388, -0.024762297, -0.028889347, 0.01746379, 0.023474326, 0.0072569596, 0.024332974, 0.017560735, 0.019984337, 0.011619445, 0.040162563, 0.010733099, 0.0017320105, 0.015303321, 0.005051481, -0.037004955, 0.022920359, -0.012789699, 0.01829474, -0.0017423974, 0.013627573, -0.025343962, -0.00766551, 0.0016212172, -0.0055639, 0.04960769, 0.045923814, -0.008392591, 0.00704576, 0.019527316, 0.0111278, -0.0015580305, -0.020552153, -0.0015978469, 0.02700586, -0.0074231494, -0.008593404, -0.63019216, -0.0016982532, -0.020233622, -0.010899289, -0.009085049, 0.015857289, 0.0062632826, 0.015566455, -0.020662947, 0.014160766, -0.027158203, 0.014375428, -0.013156702, -0.021203063, -0.03988558, -0.027393637, 0.0018904103, -0.0189595, 0.012671981, -0.010220679, -0.0021293084, 0.02107842, -0.0035401916, -0.0048887534, 0.0181147, 0.0040093316, 0.005124189, -0.009652864, -0.00032307493, 0.018474778, -0.019541165, 0.025025431, -0.0010135854, 0.010546135, 0.04348636, 0.0006980842, -0.027088957, 0.04434501, 0.028418476, 0.0029914186, -0.013087456, -0.011287065, 0.010926987, -0.0011416901, 0.014873997, 0.0029723758, 0.00601746, -0.01087159, -0.0082125515, 0.018031606, 0.012928191, -0.013856084, -0.01368297, 0.0054877293, -0.0125127155, 0.0013061488, 0.028307682, -0.038805347, 0.0050930283, -0.007031911, 0.017436093, 0.015317171, -0.018267041, -0.011965674, -0.002352626, -0.0009538609, -0.0067895507, 0.0058478075, 0.014680109, 0.004601383, -0.0068241735, 0.031465292, -0.028473873, -0.019804299, 0.012083392, 0.0035869323, 0.013371363, 0.0099783195, -0.002255682, 0.01664669, 0.008918859, -0.010656929, -0.014347729, 0.011910277, 0.008773442, 0.0075754905, -0.019305728, 0.008960406, -0.0061213286, -0.0019561937, -0.004227456, 0.016605143, 0.021383103, -0.023695912, 0.017505338, 0.019582711, 0.018724063, -0.020815287, 0.0012360375, -0.019707354, -0.02754598, -0.008011739, 0.009154295, 0.009548996, 0.008295647, 0.000937415, 0.006671833, 0.0060347714, 0.03595242, -0.061878044, -0.0062494334, 0.010379945, 0.012270356, -0.0016627647, 0.02686737, -0.026438046, 0.030634342, -0.0071807895, -0.0032961, -0.0098467525, 0.017560735, 0.024305275, -0.024083689, -0.039193124, 0.015095584, 0.03116061, -0.009278937, -0.019984337, -0.015275623, 0.0062009613, 0.009964471, 0.013253646, 0.032850206, -0.00091317896, 0.0068691834, 0.001492247, 0.024956185, 0.008704197, 0.0126996795, -0.019125689, 0.002390711, -0.023682063, 0.032850206, -0.01666054, -0.0038396795, -0.044538897, -0.0164805, -0.008960406, -0.041492082, 0.005830496, -0.0026122977, -0.018142398, -0.0085518565, 0.00187483, -0.0032753262, -0.0042690034, -0.000704576, -0.0044732788, 0.0009625166, -0.0007824775, 0.004919914, 0.010677702, -0.040301055, 0.00486798, -0.006041696, -0.004525213, 0.0022297148, 0.010566909, 0.008461837, -0.045286752, 0.0086072525, -0.0072985073, 0.0016532434, 0.035204563, -0.013530629, 0.020385964, -0.022546433, -0.006197499, -0.008600328, 0.020053584, -0.002626147, -0.034152027, -0.038168285, 0.0040508793, 0.016771333, 0.0025724815, -0.00080411683, 0.012124939, 0.010137585, 0.017906964, -0.002496311, -0.025371661, 0.0020514068, -0.0068207113, -0.011432481, 0.0036354044, 0.020413661, 0.028612364, -0.0060382336, 0.0027767564, 0.0068726456, -0.003091825, 0.03661718, -0.04021796, -0.0014853224, -0.03345957, -0.0035800077, 0.0058097225, 0.01927803, -0.0046983273, 0.0008378742, -0.015095584, -0.011072403, -0.018474778, -0.008122533, 0.036035515, 0.03082823, -0.000238898, -0.0048922156, -0.008648801, 0.014929394, -0.012630434, 0.026548838, 0.013302118, -0.025759436, -0.013115155, 0.02077374, -0.011993372, -0.0008755266, -0.014022274, -0.015081735, 0.007284658, 0.009825978, -0.017352996, 0.011751012, 0.03362576, 0.014264635, -0.008905009, 0.022352545, -0.031465292, 0.020552153, -0.0017372039, 0.007056147, 0.0015147518, 0.012069543, -0.0027646385, 0.0346229, 0.008461837, -0.011515576, 0.023834404, 0.013004361, 0.0061698006, 0.0013892439, 0.018239344, 0.0197766, -0.028917046, 0.013468307, 0.0154972095, 0.016743634, 0.012000297, 0.018751763, -0.00905735, 0.015095584, -0.0015762075, 0.021452349, 0.001712968, 0.016563594, -0.0048437435, -0.001218726, -0.024762297, -0.02785066, 0.016383557, 0.02174318, 0.019679656, 0.017256053, 0.002350895, 2.145335e-06, -0.019707354, 0.02602257, 0.0197766, -0.030551245, -0.017436093, 0.02242179, 0.022034014, 0.018239344, -0.020995326, -0.032767113, 0.014084595, -0.03332108, 0.00027611761, -0.010068339, -0.010947761, -0.023682063, -0.031576086, -0.00687957, -0.032019258, 0.016715936, -0.016923673, 0.01797621, -0.022504885, 0.004764111, -0.020842986, -0.015289472, 0.0051899725, 0.026590386, 0.0011650606, -0.0048506684, -0.011640219, -0.020524455, -0.014250785, 0.016342008, 0.010989308, -0.000931356, -0.010518437, 0.014901696, 0.020704493, -0.014527769, 0.010920063, 0.01761613, 0.011141649, 0.02110612, -0.029443314, -0.0089465575, -0.010511512, 0.10497663, 0.016840579, -0.00012009818, -0.003071051, -0.006484869, 0.0048056585, 0.006914193, -0.02667348, 0.01764383, -0.0036457912, 0.0024062914, -0.023875952, 0.0042239935, 0.0053803986, 0.013267495, -0.005217671, 0.0014905158, -0.009576694, 0.0014126142, 0.0005470418, 0.007887096, -0.00089067407, 0.024623806, 0.012658132, -0.019208785, -0.008974255, 0.026936615, 0.035010677, -0.009292786, -0.0075270184, -0.015677249, 0.006751465, 0.015954232, 0.010192982, -0.027061258, -0.022006314, -0.024831543, 0.00527653, -0.00119449, -0.0039747087, 0.023986744, 0.011107026, 0.013599874, -0.025704041, 0.012394998, -0.022310996, -0.0049337633, -0.0013797225, -0.0028113795, -0.017546885, 0.027629074, -0.021119969, -0.001970043, -0.013904557, 0.026008721, -0.01961041, 0.006363689, -0.0041028135, -0.010650004, 0.017394545, -0.014306182, -0.024665354, -0.008143306, -0.0018471316, 0.007014599, -0.04021796, -0.0055604377, -0.01401535, -0.026493443, -0.0043555605, -0.0056677684, -0.030939022, -0.024416069, -0.023543572, 0.041298196, 0.022491036, -0.004632544, -0.0015208109, 0.020358264, 0.00064009085, 0.0006344646, -0.030274263, -0.0054254085, -0.05523045, -0.01632816, -0.0070388354, -0.020385964, -0.009611317, -0.018211644, 0.00465678, -0.0048021963, 0.004681016, 0.0012118014, 0.010566909, 0.0010075264, 0.0062632826, -0.028612364, 0.00568508, 0.011564048, -0.024319125, 0.012616584, 0.005300766, -0.00898118, -0.022823416, 0.019748902, 0.013087456, -0.00781785, -0.0072084875, -0.004345174, -0.010781571, 0.004469816, -0.017768472, -0.004916452, -0.010587683, -0.026811974, 0.0072985073, 0.015566455, 0.020718344, 0.0126996795, -0.0027438647, -0.010726174, -0.006284056, 0.016909825, 0.0090019535, -0.047031745, -0.0013996307, -0.0021396952, -0.013544478, -0.018087003, -0.006221735, -0.025814833, 0.018613271, -0.0067860885, -0.026936615, -0.034539804, -0.015137131, -0.008441063, -0.0046983273, -0.021147666, 0.015123283, -0.0054184836, -0.0059032044, -0.008766518, -0.02341893, -0.0065541146, -0.028099945, -0.0015424502, -0.0063325283, 0.0032060805, 0.025302416, -0.030883627, -0.022463337, -0.021355404, -0.0026953928, 0.0112178195, -0.047004048, -0.0060970928, -0.027144354, 0.03359806, 0.011176272, 0.023959046, 0.0032424345, 0.0068691834, 0.027615225, 0.0010854279, -0.009895225, -0.021715483, -0.010518437, -0.01679903, 0.02092608, 0.029775694, 0.027310543, -0.0065125674, -0.008634951, 0.0004278092, 0.04927531, 0.0070042126, -0.011737163, -0.028750855, -0.024693051, -0.009140446, 0.012007222, 0.00938973, -0.009292786, -0.019638108, 0.0006574023, 0.028307682, 0.004604846, -0.00078507425, -0.010137585, 0.02340508, -0.0149155455, 0.0296649, 0.0046775537, 0.016397405, 0.0060624694, -0.0030762446, -0.002783681, -0.0077001327, 0.021327706, -0.021369254, 0.008233326, -0.021480046, -0.019998187, -0.024111386, 0.009507448, 0.009278937, -0.009535147, 0.013004361, -0.02437452, -0.0008924052, -0.00075564475, 0.0024703438, -0.025122376, 0.009175069, -0.0094659, -0.014583165, -0.009424353, -0.0106153805, -0.02852927, 0.0045771473, -0.0004916452, 0.03498298, -0.00065004494, 0.018737912, -0.009493599, -0.017186807, -0.012658132, 0.011169347, 0.033736553, -0.00093914615, 0.026839672, 0.0073123565, -0.011820258, 0.014458523, -0.0017951974, -0.009188917, -0.016245065, -0.03345957, 0.03841757, 0.032961, -0.0055569755, -0.019638108, 0.008974255, 0.004525213, -0.009604393, -0.016231215, -0.01186873, -0.0038050567, -0.0045044394, -0.015400265, -0.0074093007, -0.015940383, 0.017117562, 0.0004687075, -0.0029187105, -0.000465678, -0.03260092, 0.0008915397, 0.010310699, -0.013586026, 0.023266587, 0.012983588, 0.0075270184, 0.010469965, -0.0017458597, -0.010421493, -0.009424353, 0.0036007816, 0.032240845, -0.017629981, -0.00039881252, -0.010276076, 0.0090019535, -0.01277585, -0.019499617, 0.01516483, -0.0007508841, 0.00018620628, -0.0012689292, 0.0039677843, 0.0058339587, -0.008648801, -0.0076724347, -0.008309496, -0.020538304, 0.012540414, 0.014735506, 0.021826277, 0.0050687925, -0.054482594, -0.004379797, -0.013073606, 0.004649855, -0.00833027, -0.022768019, -0.02323889, 0.020579852, -0.008925783, 0.01466626, -0.019402673, 0.009493599, -0.015012489, 0.008939632, -0.015621852, 0.0064190854, 0.026258007, -0.023003453, 0.0023716686, 0.0001384916, 0.015040187, 0.0197766, 0.017837718, -0.00035899619, 0.016065026, 0.0030883625, -0.0019977414, 0.0052488316, -0.011280141, 0.0071600154, 0.03282251, 0.007582415, 0.014763204, -0.044400405, 0.019555014, -0.007118468, 0.011363235, 0.010234529, -0.021452349, 0.005016858, -0.033044096, -0.013551403, -0.0312714, -0.021383103, 0.008177929, 0.013717593, -0.014984791, 0.008101759, -0.005255756, -0.007810926, 0.0296649, 0.015026338, 0.0074439235, -0.011023931, -0.011065478, -0.014901696, 0.013779914, -0.011079328, -0.023141947, 0.0022124033, -0.012173411, 0.062930584, 0.01245732, -0.012374224, 0.012415771, 0.028044548, -0.04201835, -0.0013070145, -0.006020922, 0.027919905, 0.03426282, 0.0017640367, 0.00601746, 0.011273216, -0.0038085189, 0.00092962483, -2.8131106e-05, -0.012498867, -0.032961, -0.02556555, 0.013447534, 0.003822368, -0.048693646, 0.009999094, 0.02027517, -0.017256053, 0.0067791636, 0.010968534, 0.011917202, 0.009999094, -0.004178984, 0.00032891755, 0.019499617, 0.026770426, 0.025163922, -0.02850157, 0.009168143, 0.00035336998, 0.021119969, -0.014680109, -0.00037652403, 0.003377464, -0.013745291, -0.017685376, -0.0045840717, 0.008295647, 0.0271859, -0.005660844, 0.03476139, -0.0013286538, -0.019984337, -0.0015199453, -0.0025309338, -0.018848706, -0.023335835, -0.0040889643, 0.0055950605, 0.0037323486, 0.0064814067, -0.010026792, 0.019194935, 0.006831098, 0.030412754, -0.012346526, -0.009694411, -0.0012420965, 0.01728375, -0.008801141, 0.016217366, 0.043597154, 0.0016506467, 0.015123283, -0.015912684, 0.011321688, -0.006588738, -0.023848252, -0.005169199, 0.006003611, 0.010359172, 0.0031956937, -0.014707807, -0.011155498, -0.008198703, 0.014513919, 0.0056539197, -0.0143892765, 0.20840216, -0.0050826417, 0.0051865103, 0.023460476, -0.0062494334, -0.0035280734, 0.008842688, -0.012872794, -0.010047565, 0.017837718, -0.0011927589, 0.0031091364, -0.023474326, 0.020482907, 0.022117108, -0.018170098, -0.004428269, -0.030551245, 0.00094260846, -0.0046740915, 0.008392591, -0.016078874, 0.0015874599, -0.012097241, 0.015704947, 0.0002704914, 0.0049787727, -0.0011624638, 0.01581574, 0.008794216, -0.014292333, 0.014901696, 0.017533036, 0.0036492536, -0.03312719, 0.022809567, 0.004154748, 0.0020617936, -0.00816408, -0.030606642, 0.017089862, -0.011453255, -0.007713982, 0.00551889, 0.0038950762, 0.036118608, -0.021313857, -0.007935569, -0.03719884, 0.010352246, -0.044732787, 0.0095836185, 0.012152637, 0.022864962, 0.013752216, -0.005383861, -0.015898835, 0.026784275, -0.016826728, -0.015871137, 0.011474029, 0.014610863, -0.018585572, 0.034401312, -0.013634497, 0.0511311, -0.007679359, -0.01713141, -0.0035557717, -0.01218726, -0.016134271, -0.028003002, 0.0042759283, -0.0107469475, 0.005885893, -0.009936772, 0.035509247, 0.0043763346, -0.0010759066, -0.016120423, -0.0027975303, -0.041492082, 0.0037565846, -0.0032285855, 0.006387925, -0.038251378, 0.015206377, -0.0032614772, -0.03429052, -0.018225495, -0.012228808, -0.007949417, -0.016314311, -0.0055085034, 0.0028113795, -0.013135928, 0.019056443, 0.01714526, 0.0035401916, -0.014583165, -0.019818148, 0.05057713, 0.024180632, -0.005491192, -0.015095584, 0.0003338946, 0.011252442, 0.046394683, 0.009701337, -0.016189668, -0.0056054476, -0.023502024, 0.0024547635, -0.037226543, 0.042046048, -0.0025482455, -0.00024106193, -0.0070422976, 0.022117108, 0.004642931, 0.008905009, 0.00078161195, 0.020344416, 0.0015485091, -0.008579554, -0.025662493, -0.04647778, 0.022864962, 0.012976662, -0.008614177, 0.024416069, -0.029747995, 0.013205173, -0.008434138, -0.019735053, -0.0010516705, 0.0031818445, -0.014084595, 0.01630046, 0.0077555296, 0.009784431, 0.0035211488, 0.02487309, 0.009694411, 0.007513169, 0.003940086, -0.0039573973, -0.013322892, 0.0033012934, -0.021715483, 0.002063525, 0.0077555296, 0.011695615, -0.038694553, -0.007727831, -0.008828839, -0.018419383, -0.019374974, 0.027629074, 0.010310699, -0.043791045, 0.006367151, 0.014049972, 0.008004814, -0.016023478, -0.014901696, -0.17726925, 0.04564683, 0.012485017, -0.012304978, 0.03165918, -0.012720454, 0.037835903, -0.0038743024, -0.012720454, -0.019873545, 0.022020163, 0.008060211, -0.007921719, -0.025025431, -0.010241454, 0.011259367, -0.02538551, 0.011356311, 0.016023478, 0.020302868, 0.02686737, 0.0007954611, -0.0004842878, -0.009590543, 0.008641875, 0.0018125088, 0.0043520983, 0.006640672, 0.00014379322, -0.034401312, 0.012685831, -0.023543572, 0.026770426, -0.0027282846, -0.00059032044, -0.0017294139, 0.003270133, 0.0017744236, 0.0034224736, 0.017546885, 0.033376474, 0.0075685657, -0.005982837, 0.00087942166, -0.0034207425, 0.019984337, 0.010622306, -0.033681158, 0.023155795, -0.018530175, -0.0057681752, 0.0033618836, 0.0065021804, 0.018668666, 0.0077555296, 0.009445127, -0.000109657216, 0.001295762, -0.0044005704, 0.0046394686, -0.0035401916, -0.012145713, 0.028917046, -0.0011269754, -0.0010343591, -0.015344869, -0.008274873, 0.022214051, -0.022283299, 0.0139391795, -0.011169347, -0.013246722, 0.009175069, -0.016355857, 0.013932255, 0.008531082, -0.008967331, -0.0032164673, -0.004764111, 0.011965674, -0.027462883, 0.012069543, -0.007900946, -0.03398584, 0.0045944587, -0.013267495, -0.002925635, 0.0074369987, -0.0023145408, 0.0056192963, 0.013087456, -0.015718795, -0.021355404, -0.007021524, 0.018073153, 0.016175818, 0.010532286, -0.009957545, -0.01746379, -0.02685352, 0.0022158655, -0.028210739, -0.010636155, 0.0036354044, 0.0076170377, -0.010158359, 0.010421493, 0.017740773, 0.046699367, -0.017740773, 0.024789996, -0.0021570066, 0.02685352, 0.0071461666, -0.006003611, 0.025579398, 0.024900788, -0.011979523, 0.015538757, -0.017394545, 0.050881814, -0.0016056369, 0.020399813, 0.022269448, -0.001528601, -0.011965674, -0.1153358, -0.002411485, 0.011757936, 0.024513012, -0.015608003, 0.027961453, -0.0057612504, 0.018100852, -0.018488629, 0.010040641, 4.7958125e-05, -0.033071794, 0.00046957307, 0.025316264, 0.0035973191, -0.02092608, 0.019402673, -0.006052083, -0.011674842, 0.04010717, -0.0043140133, -0.009922923, 0.0062078857, -0.0238898, 0.01764383, 0.0059759123, -0.016342008, 0.009687487, 0.017269902, 0.008988105, 0.008198703, -0.0020012036, 0.0047087143, -0.0164805, 0.0051657367, -0.014029198, 0.010740023, -0.00079156604, 0.0020981478, -0.016037326, 0.0029741072, -0.012450394, 0.0052488316, -0.043153983, -0.0021570066, 0.0012403653, -0.029831091, -0.0119310515, 0.010158359, -0.024319125, -0.025080828, -0.04171367, -0.007582415, 2.3072917e-05, 0.014790903, -0.013946104, -0.0021812427, 0.0033445721, 0.0075408677, -0.009348183, 0.010276076, 0.01859942, -0.02355742, 0.007250035, 0.009438203, 0.006277132, -0.017117562, -0.021950917, 0.0076932083, -0.01377299, -0.018502478, 0.023474326, -0.030191168, 0.018710215, -0.031382196, -0.00955592, -0.010982384, -0.011903353, 0.017990058, -0.013156702, -0.012644283, -0.0022764555, 0.019001046, -0.028667761, 0.022020163, 0.012311903, 0.030634342, 0.0013373095, 0.004213607, -0.005719703, -0.0070976946, -0.0018834857, 0.0313268, -0.02506698, -0.008621102, 0.034179725, 0.027421337, -0.0025638256, 0.0134890815, 0.033570364, -0.024513012, -0.016314311, -0.04420652, 0.019167237, -0.008884236, -0.012131864, -0.003450172, -0.0032562837, -0.009098898, -0.020205924, -0.0017830794, 0.004168597, -0.023806706, 0.026590386, 0.004597921, -0.014236936, -0.028778553, 0.0063394527, 0.012685831, -0.011300914, 0.0030018054, 0.034401312, -0.018377835, 0.012429621, 0.01663284, -0.015746495, -0.011280141, 0.014693959, -0.006623361, 0.025662493, -0.0028234974, -0.020067433, 0.002208941, -0.036977258, -0.018710215, -0.0058062603, -0.020912232, -0.020579852, -0.02670118, 0.023682063, 0.01251964, 0.06016075, -0.014583165, -0.036977258, 0.010982384, -0.026354952, 0.0020063971, 0.011238593, -0.007935569, 0.0065021804, 0.0024495702, 0.0013234604, 0.011806409, 0.038860742, -0.013454459, -0.0044144196, -0.03309949, -0.019887393, 0.012755076, 0.016051177, -0.016092723, -0.03542615, 0.024762297, 0.007630887, 0.0078386245, -0.013496006, 0.022809567, -0.019901242, -0.02850157, 0.022144806, -0.0016367976, -0.0214385, 0.00093828054, -0.0009538609, 0.024609957, 0.00070587435, 0.010172208, 0.0025257405, 0.027670622, -0.0071323174, -0.00096771005, 0.027393637, -0.0011841032, -0.042461522, 0.0027092418, 0.014105369, 0.021632388, -0.034678295, -0.0072915824, 0.023917498, -0.015469511, 0.010982384, 0.026244158, 0.0011529425, -0.03395814, -0.032988697, -0.020898381, 0.003988558, -0.019638108, 0.028917046, 0.013212099, 0.01029685, 0.0012031457, 0.011951825, 0.011557124, -0.008524158, 0.0012325752, 0.0025638256, -0.014569316, -0.020469058, 0.018031606, 0.01596808, -0.005494654, 0.025122376, 0.013378289, 0.0005414156, -0.013544478, 0.022269448, 0.0023959046, -0.022186354, -0.012678905, 0.016037326, 0.014860149, -0.0010222411, 0.026618086, 0.0060278466, -0.020579852, 0.01929188, 0.014250785, -0.012298054, 0.0063948496, 0.0040924265, 0.011065478, 0.012270356, -0.035980117, -0.013364439, 0.0033376475, -0.0280307, 0.004549449, -0.014583165, -0.014167691, 0.034733694, 0.04434501, 0.0032147362, 0.0072569596, -0.00071236613, 0.047724206, -0.012221883, 0.00067817606, 0.009542071, -0.02406984, 0.0094659, 0.010684627, 0.030135771, -0.024194483, -0.02272647, 0.03974709, -0.023460476, 0.013883783, -0.037337333, -0.012318827, 0.021133818, 0.00050809106, 0.0098883, -0.003929699, -0.04318168, -0.030578945, 0.038251378, -0.0048472057, 0.008489535, 0.001635932, 0.014022274, 0.012886643, -0.037171144, -0.009022728, 0.02390365, -0.012803548, -0.017034467, -0.013129003, 0.01129399, 0.015469511, -0.015275623, 0.0073608286, -0.015760344, -0.027573677, 0.017990058, 0.0026365337, -0.011972599, 0.00766551, -0.020884532]
