Chapter Number	Chapter Text	Chapter Embedding
13	"XIII.
CONCERNING AUXILIARIES, MIXED SOLDIERY, AND ONE’S OWN


Auxiliaries, which are the other useless arm, are employed when a
prince is called in with his forces to aid and defend, as was done by
Pope Julius in the most recent times; for he, having, in the enterprise
against Ferrara, had poor proof of his mercenaries, turned to
auxiliaries, and stipulated with Ferdinand, King of Spain,[1] for his
assistance with men and arms. These arms may be useful and good in
themselves, but for him who calls them in they are always
disadvantageous; for losing, one is undone, and winning, one is their
captive.

 [1] Ferdinand V (F. II of Aragon and Sicily, F. III of Naples),
 surnamed “The Catholic,” born 1452, died 1516.

And although ancient histories may be full of examples, I do not wish
to leave this recent one of Pope Julius the Second, the peril of which
cannot fail to be perceived; for he, wishing to get Ferrara, threw
himself entirely into the hands of the foreigner. But his good fortune
brought about a third event, so that he did not reap the fruit of his
rash choice; because, having his auxiliaries routed at Ravenna, and the
Switzers having risen and driven out the conquerors (against all
expectation, both his and others), it so came to pass that he did not
become prisoner to his enemies, they having fled, nor to his
auxiliaries, he having conquered by other arms than theirs.

The Florentines, being entirely without arms, sent ten thousand
Frenchmen to take Pisa, whereby they ran more danger than at any other
time of their troubles.

The Emperor of Constantinople,[2] to oppose his neighbours, sent ten
thousand Turks into Greece, who, on the war being finished, were not
willing to quit; this was the beginning of the servitude of Greece to
the infidels.

 [2] Joannes Cantacuzenus, born 1300, died 1383.

Therefore, let him who has no desire to conquer make use of these arms,
for they are much more hazardous than mercenaries, because with them
the ruin is ready made; they are all united, all yield obedience to
others; but with mercenaries, when they have conquered, more time and
better opportunities are needed to injure you; they are not all of one
community, they are found and paid by you, and a third party, which you
have made their head, is not able all at once to assume enough
authority to injure you. In conclusion, in mercenaries dastardy is most
dangerous; in auxiliaries, valour. The wise prince, therefore, has
always avoided these arms and turned to his own; and has been willing
rather to lose with them than to conquer with the others, not deeming
that a real victory which is gained with the arms of others.

I shall never hesitate to cite Cesare Borgia and his actions. This duke
entered the Romagna with auxiliaries, taking there only French
soldiers, and with them he captured Imola and Forli; but afterwards,
such forces not appearing to him reliable, he turned to mercenaries,
discerning less danger in them, and enlisted the Orsini and Vitelli;
whom presently, on handling and finding them doubtful, unfaithful, and
dangerous, he destroyed and turned to his own men. And the difference
between one and the other of these forces can easily be seen when one
considers the difference there was in the reputation of the duke, when
he had the French, when he had the Orsini and Vitelli, and when he
relied on his own soldiers, on whose fidelity he could always count and
found it ever increasing; he was never esteemed more highly than when
every one saw that he was complete master of his own forces.

I was not intending to go beyond Italian and recent examples, but I am
unwilling to leave out Hiero, the Syracusan, he being one of those I
have named above. This man, as I have said, made head of the army by
the Syracusans, soon found out that a mercenary soldiery, constituted
like our Italian condottieri, was of no use; and it appearing to him
that he could neither keep them nor let them go, he had them all cut to
pieces, and afterwards made war with his own forces and not with
aliens.

I wish also to recall to memory an instance from the Old Testament
applicable to this subject. David offered himself to Saul to fight with
Goliath, the Philistine champion, and, to give him courage, Saul armed
him with his own weapons; which David rejected as soon as he had them
on his back, saying he could make no use of them, and that he wished to
meet the enemy with his sling and his knife. In conclusion, the arms of
others either fall from your back, or they weigh you down, or they bind
you fast.

Charles the Seventh,[3] the father of King Louis the Eleventh,[4]
having by good fortune and valour liberated France from the English,
recognized the necessity of being armed with forces of his own, and he
established in his kingdom ordinances concerning men-at-arms and
infantry. Afterwards his son, King Louis, abolished the infantry and
began to enlist the Switzers, which mistake, followed by others, is, as
is now seen, a source of peril to that kingdom; because, having raised
the reputation of the Switzers, he has entirely diminished the value of
his own arms, for he has destroyed the infantry altogether; and his
men-at-arms he has subordinated to others, for, being as they are so
accustomed to fight along with Switzers, it does not appear that they
can now conquer without them. Hence it arises that the French cannot
stand against the Switzers, and without the Switzers they do not come
off well against others. The armies of the French have thus become
mixed, partly mercenary and partly national, both of which arms
together are much better than mercenaries alone or auxiliaries alone,
but much inferior to one’s own forces. And this example proves it, for
the kingdom of France would be unconquerable if the ordinance of
Charles had been enlarged or maintained.

 [3] Charles VII of France, surnamed “The Victorious,” born 1403, died
 1461.

 [4] Louis XI, son of the above, born 1423, died 1483.

But the scanty wisdom of man, on entering into an affair which looks
well at first, cannot discern the poison that is hidden in it, as I
have said above of hectic fevers. Therefore, if he who rules a
principality cannot recognize evils until they are upon him, he is not
truly wise; and this insight is given to few. And if the first disaster
to the Roman Empire[5] should be examined, it will be found to have
commenced only with the enlisting of the Goths; because from that time
the vigour of the Roman Empire began to decline, and all that valour
which had raised it passed away to others.

 [5] “Many speakers to the House the other night in the debate on the
 reduction of armaments seemed to show a most lamentable ignorance of
 the conditions under which the British Empire maintains its existence.
 When Mr Balfour replied to the allegations that the Roman Empire sank
 under the weight of its military obligations, he said that this was
 ‘wholly unhistorical.’ He might well have added that the Roman power
 was at its zenith when every citizen acknowledged his liability to
 fight for the State, but that it began to decline as soon as this
 obligation was no longer recognised.”—_Pall Mall Gazette_, 15th May
 1906.

I conclude, therefore, that no principality is secure without having
its own forces; on the contrary, it is entirely dependent on good
fortune, not having the valour which in adversity would defend it. And
it has always been the opinion and judgment of wise men that nothing
can be so uncertain or unstable as fame or power not founded on its own
strength. And one’s own forces are those which are composed either of
subjects, citizens, or dependents; all others are mercenaries or
auxiliaries. And the way to make ready one’s own forces will be easily
found if the rules suggested by me shall be reflected upon, and if one
will consider how Philip, the father of Alexander the Great, and many
republics and princes have armed and organized themselves, to which
rules I entirely commit myself."	[-0.007050045, 0.0040397984, 0.004997759, -0.025418343, 0.0014514297, 0.028827457, -0.008079597, -0.016336467, -0.028363816, -0.03185475, 0.036463868, 0.010813705, -0.0071659544, 0.02124559, -0.005055714, 0.0045920745, 0.04682757, 0.026850171, 0.024613792, -0.011693256, 0.010159155, -0.0028432, -0.0028261542, 0.0017591021, 0.00810687, 0.022227414, 0.013411449, -0.01513646, 0.024613792, -0.032700207, 0.019568305, 0.01348645, -0.019568305, -0.0071455, -0.044454828, -0.007779595, 0.0062114033, -0.01917285, 0.012170532, 0.0015545554, 0.03335476, 0.006637542, -0.004547756, -0.0107114315, -0.050809413, 0.020100128, -0.0065795872, -0.009722789, -0.0057307184, 0.023754697, 0.046036657, 0.018845575, -0.022513779, -0.00121961, -0.013479631, -0.0034466127, -0.033982035, 0.040745713, -0.01875012, -0.019704672, 0.013520541, 0.020072855, -0.0007014249, 0.0052227606, -0.02554107, -0.01828648, -0.016963745, 0.0018358071, -0.023577422, -0.002120468, 0.025963802, 0.02116377, 0.005161396, -0.0015724532, 0.047809396, -0.021150135, -0.026413804, 0.0017105222, -0.020604676, -0.014263727, -0.013704632, -0.03949116, -0.02050922, -0.011584165, 0.017127382, -0.008850057, 0.0023983107, 0.030600194, -0.0033528623, -0.016841017, 0.007090954, 0.020263765, 0.019950127, -0.0030392238, -0.016336467, 0.0054170797, -0.020345584, 0.0021068316, -0.018641027, -0.0033835443, -0.012654626, -0.0012332465, -0.058145825, -0.0065318597, -0.024777431, -0.013540995, -0.006692088, -0.023331966, 0.0028210406, -0.015000096, 4.5836583e-05, 0.025609253, 0.022404687, -0.037336603, 0.026672896, -0.037527513, 0.0075477753, -0.01598192, 0.016186466, -0.0051068505, 0.0050045773, 0.027491083, -0.0037159326, 0.00343809, 0.035127494, 0.009784153, -0.0014190432, 0.015818283, -0.02792745, -0.017263746, 0.011856894, 0.0102273375, 0.026222894, 0.0046568476, -0.006361404, 0.010834159, -0.013377358, -0.012640989, -0.0097773345, -0.021409227, 0.026318349, 0.007356865, -0.0071455, -0.0033818397, -0.0043159365, 0.016036466, 0.009409151, -0.016050102, -0.012402352, 0.002512516, 0.03529113, -0.015859192, 0.019704672, -0.026318349, 0.016950108, -0.0036204776, -0.026986536, 0.030054737, -0.0048954855, -0.004022753, 0.0041454807, 0.028036542, 0.018668301, -0.015191006, 0.0135478135, 0.025677435, -0.001694329, 0.022336505, -0.006572769, -0.011427346, 0.019841036, 0.009518242, -0.01716829, 0.022418324, -0.012075077, 0.021722866, 0.0141273625, 0.020141037, -0.028063815, -0.005294352, 0.010111428, -0.007206864, 0.04663666, 0.01771375, -0.012995537, 0.006422768, 0.00018025683, 0.011052343, -0.0007188966, -0.014972823, -0.015627371, 0.015654646, 0.0021596728, -0.0030392238, -0.6301131, -0.010322792, -0.016445559, -0.0228956, -0.0054034432, 0.0060477657, 0.0035386588, 0.009245513, -0.020563766, 0.014822821, -0.04336391, 0.028554726, -0.02316833, -0.0173592, -0.010445521, -0.021968322, 0.008263689, -0.01805466, -0.0034977496, -0.0079091415, -0.0018920575, 0.009709152, 0.009415969, -0.0026267213, 0.0021221726, -0.017195564, 0.026522895, -0.010125064, 0.012218259, 0.019145576, -0.021068316, 0.011086434, -0.011011434, -0.009129603, 0.036654778, -0.013888725, -0.030491102, 0.042736635, 0.021450136, 0.0034943405, -0.009272786, -0.010765977, -0.0011079616, -0.009259149, 0.009463697, -0.006637542, 0.00031832588, 0.011359164, 0.0012750081, 0.0047352575, 0.015300097, -0.004745485, -0.014754639, -0.013977362, -0.0030494512, -0.0038318424, 0.010902342, -0.02942746, -0.013929634, 0.01133189, 0.0076568667, 0.013097811, -0.010963706, -0.003342635, -0.0036136594, 0.013697814, -0.0061704936, 0.0015912033, 0.01809557, -1.35365735e-05, 0.00020188339, 0.016841017, -0.044236645, -0.017291019, -0.0039784345, -0.009613697, 0.002577289, 0.009081876, -0.01659556, 0.0070704995, 0.015491008, -0.009934154, -0.014277363, 0.026372895, 0.01686829, 0.0067023155, -0.037118416, 0.008911421, -0.02750472, -0.0134182675, -0.003238657, 0.029209277, -0.0034653628, -0.026168348, 0.01191144, 0.024722885, -0.0076432303, -0.005935265, 0.02382288, -0.030354738, -0.012531898, -0.019336486, 0.021300135, 0.0031091108, 0.0012349511, 0.0024869477, 0.0030102464, 0.01579101, 0.05601854, -0.052336697, 0.015081914, 0.007806868, 0.026550168, 0.013015992, 0.023959244, -0.0201274, 0.016977381, -0.0012358034, -0.008979603, -0.03300021, 0.023045601, -0.0031261563, -0.0020880816, -0.026727442, 0.011004616, 0.036518414, -0.00902733, -0.018586481, -0.025881983, -0.010881888, -0.016104648, -0.006852316, 0.03760933, -0.0023216056, 0.013077356, -0.018395571, 0.025295615, 0.004786394, 0.022731964, -0.009600061, 0.00013242272, -0.014986459, 0.023072874, -0.022336505, -0.011400073, -0.05342761, -0.031745657, -0.020059219, -0.034363855, 0.026386531, -0.0027528584, -0.020836497, -0.012825081, -0.00791596, -0.004643211, -0.0056966273, -0.034936585, 0.001832398, 0.0060648113, -0.0152864605, -5.5464666e-06, 0.018613754, -0.019336486, 0.014331909, 0.0013977361, -0.015518281, -0.003998889, 0.025445616, 0.0007410559, -0.04720939, 0.0076909577, 0.0041829813, -0.014877367, 0.03166384, -0.023754697, 0.02055013, -0.02735472, 0.015041005, 0.0040738895, 0.017795568, 0.016118284, -0.029645642, -0.021941049, -0.0007930448, 0.0122250775, -0.02266378, 0.009981882, -0.0008889261, -0.0016193285, 0.013656905, -0.009859154, -0.009177331, -0.005543217, -0.008195506, 7.084562e-06, 0.011815984, 0.00968188, 0.05170942, -0.00022904975, 0.009361424, 0.0020659221, -0.008700055, 0.04129117, -0.036818415, 0.018422844, -0.03272748, 0.016636468, 0.0015818282, 0.043691188, -0.0017744431, -0.0059216283, -0.0071045905, -0.011154616, -0.021641046, 0.0026216076, 0.040009346, 0.032018386, -0.012613717, 0.0045000287, 0.014168272, 0.009954609, -0.004789803, 0.024286518, 0.0031074062, -0.028936548, -0.01632283, 0.024627429, -0.0101318825, -0.01640465, -0.0003266356, -0.011761438, 0.014004635, 0.010056882, -0.0054682167, 0.01898194, 0.024872886, 0.008536418, -0.007670503, 0.01909103, -0.042245723, -9.124703e-05, 0.009238695, -0.0047352575, 0.010472794, 0.011556892, -0.009661425, 0.037527513, 0.01583192, -0.014291, 0.033682033, 0.019881945, 0.011590983, 0.016718289, 0.01191144, 0.00060469133, -0.03780024, 0.023768334, 0.011229617, 0.024150154, 0.020618312, 0.020686496, 0.00064943597, 0.00921824, -0.001771034, 0.013350084, 0.0033068391, 0.013090992, -0.011836438, -0.009272786, -0.008379599, -0.02105468, 0.00026804148, 0.024286518, 0.004479574, 0.02942746, -0.0011130753, 0.014004635, -0.024286518, 0.01313872, 0.011959167, -0.027259264, -0.05435489, 0.0121296225, 0.022200141, 0.002221037, -0.013090992, -0.044727556, 0.015300097, -0.021027407, 0.018518299, -0.0064841323, -0.010425067, 0.005055714, -0.016772835, 0.006988681, -0.009320513, 0.018122843, -0.016650107, 0.027886542, -0.01594101, 0.013036447, -0.032672934, -0.017768295, 0.0024000152, 0.041263897, 0.0069375443, -0.023345603, -0.015000096, -0.020277401, -0.013765996, 0.0060136747, 0.008447781, -0.011604619, -0.008959148, 0.039518435, 0.009190967, -0.037118416, 0.015109187, 0.02942746, 0.016731925, 0.011877349, -0.04360937, 0.00024098165, -0.0029164958, 0.10352793, 0.010636431, -0.010472794, 0.013813724, 0.00879551, -0.0019448987, -0.0018034206, -0.025022887, 0.029127458, 0.0013073947, 0.01471373, -0.0071114087, 0.018272843, 0.0099887, 0.023877425, 0.0010346656, 0.003337521, 0.0032829754, -0.0034278627, -0.0016525673, 0.0044079823, -0.0075205024, 0.00914324, 0.0011991553, -0.013002356, -0.0015494417, 0.024613792, 0.016091011, 0.0020812633, -0.0021494455, -0.019022848, -0.0143182725, 0.014113726, 0.013793269, -0.034663856, -0.044345737, -0.02350924, 0.039791163, 0.010840978, -0.021913776, 0.02665926, 0.012109168, 0.019268304, -0.02370015, 0.006436405, -0.026441077, -0.008502327, 0.0031670656, -0.003030701, -0.0008326757, 0.027231991, -0.0042272997, -0.002735813, -0.02623653, 0.021695593, -0.00022564064, 0.0022022866, 0.015845556, -0.018300116, 0.03856388, -0.004503438, -0.014795548, 0.018491026, -0.005744355, -0.020754678, -0.038918428, -0.012784172, -0.0035591135, -0.03507295, -0.0003230134, 0.013411449, -0.017563747, -0.01260008, 0.004990941, 0.023250148, 0.016309194, 0.004987532, -0.0053216247, -0.0037363875, 0.0051818513, -0.0009204604, -0.016909199, -0.005059123, -0.03499113, -0.022813782, 0.013922816, -0.016486468, 0.013343266, 0.0011113707, 0.0108068865, -0.012593262, 0.024777431, -0.0050727595, -0.011038707, 0.022868328, 0.00316877, -0.0058364007, -0.009722789, 0.011815984, -0.027218355, -0.002221037, -0.020195583, -0.012463716, -0.027641084, 0.016445559, 0.013963725, -0.01898194, -0.014754639, -0.011093252, -0.011727347, -0.020277401, -0.02485925, -0.010056882, -0.0145773655, -0.033491123, -0.0027272901, 0.008079597, 0.022609234, 0.015859192, -0.0028227451, -0.0068591344, -0.016991017, 0.008665964, 0.014741003, -0.035509318, 0.013193266, -0.013002356, -0.025868347, -0.018654663, 0.0033954761, -0.016391013, 0.028063815, -0.006395495, -0.0002469476, -0.040282074, -0.006845498, -0.01640465, -0.0075273206, -0.03283657, -0.0020113764, 0.017195564, 0.0004203862, -0.0051818513, -0.033791125, 0.009381878, -0.021641046, -0.001678988, 0.0025602435, 0.005713673, -0.004639802, -0.03207293, -0.020659221, -0.000808812, -0.015354643, 0.0073705013, -0.012729626, 0.0048682126, -0.030245647, 0.02961837, 0.01602283, 0.018327389, -0.016186466, 0.030245647, 0.016091011, -0.019104667, 0.005086396, -0.00921824, -0.014931913, -0.027600175, 0.02850018, 0.033245664, 0.03177293, 0.0057273093, -0.012811445, 0.009020512, 0.047154844, -0.002347174, -0.031991113, -0.027736539, -0.03130929, 0.004602302, -0.007711413, 0.009075058, -0.010759159, -0.018654663, -0.012845536, 0.040963896, -0.0017625112, 0.004581847, -0.009838699, 0.010534158, 0.007881869, 0.035127494, 0.013834178, 0.006269358, 0.005059123, 0.010200065, 0.0056284447, 0.0025551298, 0.0037091144, -0.0172092, -0.009047785, -0.016691016, 0.005359125, -0.008365963, 0.00557049, 0.016991017, -0.007186409, 0.008556873, -0.016077375, -0.017413747, -0.010261429, 0.008059142, -0.0007457434, 0.012490989, -0.0072136824, -0.0053216247, -0.006150039, -0.009409151, -0.024600156, 0.0018085343, -0.0022806963, 0.024450155, 0.003253998, 0.015231915, 0.0062489035, -0.017004654, -0.008250052, 0.014931913, 0.028527454, 0.0036477505, 0.009272786, 0.0069375443, -0.016227376, 0.011222798, 0.005389807, 0.0074932296, -0.011693256, -0.0035591135, 0.04805485, 0.032863844, 0.006787543, -0.017072836, -0.001292906, -0.027600175, -0.0007142091, -0.0157501, 0.021845594, -0.004097753, -0.0019397851, -0.0016005783, 0.0040772986, 0.00012943974, 0.019377396, -0.0031892247, -0.020072855, -0.0031074062, -0.04260027, -0.008829602, 0.026522895, -0.012620535, 0.018081933, 0.009811426, 0.0050352593, 0.01163871, 0.011393255, -0.006777316, -0.0035216133, 0.00085781794, 0.029291095, -0.03490931, 0.03283657, 0.0011233026, -0.001651715, 0.008461418, -0.009886427, 0.004414801, -0.0030818377, -0.006637542, -0.006501178, -0.0005386398, 0.019159213, -0.017127382, -0.00879551, 0.0006826748, -0.011590983, 0.0062454944, 0.009859154, 0.0060682204, -0.009811426, -0.04606393, -0.010431885, -0.0024306972, 0.008652328, -0.004125026, 0.0006140664, -0.015654646, 0.011263708, 0.0067364066, 0.021463772, -0.017877387, 0.0050454866, 0.0060136747, 0.0132887205, 0.016636468, 0.0044284374, 0.027736539, -0.018463753, -0.011529619, -0.0049398043, 0.014754639, 0.016691016, 0.010145519, 0.0051307143, 0.0074932296, 0.016841017, -0.0046227565, -0.010138701, -0.015777374, -0.0021869456, 0.022309233, 0.015259188, 0.013479631, -0.04756394, -0.0058909464, -0.008270507, 0.013963725, 0.0009997223, -0.023454694, -0.012136441, 0.00084247696, -0.009102331, -0.008168234, -0.01405918, -0.00028167793, 0.0065829963, -0.0051102596, 0.014359182, -0.0017505793, -0.0100637, 0.02678199, -0.017072836, 0.020004673, 0.0022074005, -0.0110659795, 4.9591934e-05, 0.0026062666, -0.0067977705, -0.02327742, 0.0051375325, -0.01621374, 0.04731848, 0.0029352459, -0.0062182215, -0.006712543, 0.012777354, -0.016991017, -0.007888687, -0.006426177, 0.021368317, 0.0298911, 0.01682738, 0.01025461, 0.028663818, 0.013718269, -0.019227395, 0.005679582, -0.030572921, -0.020877406, -0.0068045887, 0.006596633, 0.012893264, -0.053918526, 0.026359258, 0.007670503, -0.015722828, 0.017645566, 0.008536418, 0.008215961, 0.002757972, -0.0012980197, 0.009477333, 0.01583192, 0.02689108, 0.020631948, -0.038782064, -0.012156895, -0.0045545744, 0.02562289, -0.010943252, -0.0004372187, 0.00084332924, -0.019418305, 0.0015375097, -0.0073500467, 0.007663685, 0.017563747, -0.017959205, 0.03027292, -0.011727347, -0.0076432303, 0.0014744411, -0.0040432075, -0.014086453, -0.022213778, -0.003507977, 0.012886446, -0.0047011664, 0.008700055, -0.0057000364, 0.007629594, -0.011604619, 0.038509335, -0.021191044, -0.0077727768, 0.0031108153, 0.02850018, 0.0019244441, 0.011386436, 0.032018386, -0.011740983, 0.018381935, -0.02412288, 0.02378197, 0.0068011796, -0.022513779, -0.020304674, 0.0015102369, -0.004397755, 0.008025051, -0.016036466, -0.03987298, -0.0009153467, -0.004414801, -0.025036523, -0.008611418, 0.21065588, -0.00879551, 0.003422749, 0.024954705, -0.012702353, 0.0042648, -0.0019738763, -0.009934154, -0.007472775, 0.018136479, -0.0066579967, -0.00034155048, -0.035045676, 0.0039784345, 0.027300173, -0.014236454, -0.017331928, -0.040363893, -0.0024733113, 0.0012954628, 0.005096623, 0.011004616, -0.015491008, -0.025936529, 0.009865972, -0.012327351, -0.004990941, 0.0021681956, 0.00076193665, -0.004540938, -0.025663799, -0.011120525, 0.024750158, 0.0090682395, -0.032318387, 0.0058057187, -0.005580717, 0.009886427, -0.0024017198, -0.0020659221, 0.03433658, -0.011536437, -0.0013414858, 0.007513684, 0.03245475, 0.026604714, -0.025650162, -0.013588723, -0.032482024, 0.007390956, -0.022950146, 0.0036443414, 0.021041043, 0.02792745, 0.019391032, -0.0061364025, -0.000790488, 0.016268285, -0.01167962, -0.010152337, -0.0069818627, 0.010145519, 0.0003622182, 0.048109397, -0.0030852468, 0.039300248, -0.002889223, -0.03507295, -0.0042204815, -0.02839109, -0.027586538, -0.009668243, -0.008918239, 0.0022670599, -0.01294781, -0.020454675, 0.0131591745, 0.004575029, -0.009238695, -0.026331985, 0.010990979, -0.011945531, -0.00841369, 0.008597782, -0.012736444, -0.027381992, -0.002442629, -0.012218259, -0.028882002, -0.004206845, -0.009838699, -0.02293651, -0.009204604, -0.0029846781, 0.0046159383, -0.010152337, 0.013943271, 0.02370015, 0.002028422, -0.024150154, -0.018531935, 0.04270936, 0.011004616, -0.0064329957, -0.012068259, -0.0058943555, 0.009347787, 0.025254706, -0.0023113783, -0.011365982, -0.008727328, -0.028472908, -0.003934116, -0.018300116, 0.030000191, -0.016009193, -0.005577308, -0.0014267137, 0.024436519, -0.0026233122, 0.0067943614, 0.00041719014, 0.013281902, 0.015600099, -0.0075818663, -0.027327446, -0.062073123, 0.028554726, 0.010418248, 0.004510256, 0.021927413, -0.032945663, 0.024736522, 0.014468274, -0.012531898, 0.011325072, -0.006572769, 0.0073773195, -0.0035693408, 0.009838699, 0.0044113914, -0.012729626, 0.03130929, 0.009961427, 0.018191025, -0.0062864036, 0.01210235, -0.015627371, 0.01602283, -0.023850152, -0.0033750215, 0.025841074, 0.00077088556, -0.034091126, 0.01947285, -0.01191144, -0.024995614, -0.023331966, 0.027000172, 0.023413785, -0.02500925, 0.0030068373, 0.019431941, -0.011522801, -0.021068316, -0.029482005, -0.17334655, 0.030136555, 0.00020582517, -0.014454638, 0.025063796, -0.0012775649, 0.017454656, 0.011604619, -0.0064534503, -0.04044571, 0.014850094, 0.0038625246, -0.0071114087, -0.02270469, 0.0030255874, -0.008004596, -0.030327465, 0.008440963, 0.02800927, 0.02589562, 0.030409284, 0.0014446115, -0.0029437686, -0.013104629, 0.023400148, -0.014768275, -0.0045511653, 0.010022791, -0.006906862, -0.029754734, 0.011052343, -0.00072912395, 0.02154559, -0.01809557, -0.0061636753, 0.0004602302, 0.014959186, 0.016991017, 0.010452339, 0.02170923, 0.023563785, -0.002497175, -0.0055329897, -0.013247811, -0.006777316, 0.035563864, 0.0030409284, -0.030982016, 0.021231953, -0.027231991, 0.011918258, -0.011693256, 0.0016900676, 0.019295577, 0.0022619462, -0.0011599505, -0.027109263, -0.015995556, 0.0076227756, 0.017154654, -0.007902323, -0.003103997, 0.021572864, -0.010261429, -0.0028943366, -0.017127382, -0.011018252, 0.015041005, -0.028527454, 0.024450155, 0.009300059, 0.010595522, 0.002561948, -0.02731381, 0.009184149, -0.013602359, -0.009497788, -0.0032744526, -0.018013751, 0.008079597, -0.0143182725, 0.009750062, -0.008386417, -0.022881964, -0.008911421, 0.008222779, 0.0030818377, -0.0070773177, -0.011263708, -0.008386417, 0.0004875031, -0.029072912, -0.02397288, -0.01079325, 0.0053523066, 0.019609215, 0.014809185, -0.020972861, -0.010384157, -0.031636566, 0.0039511616, -0.030163828, -0.029291095, 0.0060989023, 0.018968303, -0.0120000765, 0.0021341045, 0.002561948, 0.035372954, -0.02175014, 0.023045601, -0.0020233083, 0.009013694, 0.019813763, -0.00583981, 0.027041081, 0.024436519, -0.015259188, 0.018327389, -0.012109168, 0.056454904, -0.0010985865, 0.024245609, 0.024041062, -0.010159155, -0.017781932, -0.12949173, 0.016841017, 0.00949097, 0.015191006, -0.0065216324, 0.015504644, -0.014931913, 0.0122250775, -0.025213797, 0.008563691, -0.018409207, -0.025022887, -0.0010764273, 0.006784134, 0.02308651, 0.0004286959, -0.011802347, -0.0119046215, -0.01890012, 0.023618331, -0.012586444, -0.0045204833, -0.008931875, -0.011134162, 0.010547794, 0.009688698, -0.02431379, 0.033409305, 0.017004654, -8.384286e-05, 0.018013751, -0.0061091296, 0.008856875, -0.016445559, 0.003180702, -0.014659184, 0.0029795645, -0.009422787, 0.0088773295, -0.005059123, 0.0114478, 0.003903434, -0.0053454884, -0.0344184, 0.03130929, -0.0059489016, -0.0036238867, -0.0019653535, 0.0062216306, -0.017809205, -0.038809337, -0.028418362, -0.028036542, -0.0025568344, 0.0067057246, -0.008802328, -0.00070185104, 0.023059238, -0.0018681937, -0.0007423343, -0.011761438, 0.0075205024, -0.008515963, -0.003698887, 0.0050693504, 0.0061909487, -0.019704672, -0.021668319, 0.012463716, -0.010813705, -0.011543255, 0.008440963, -0.018954666, 0.009504606, -0.040091164, -0.005546626, -0.019213758, 0.0041625267, 0.034854766, -0.018136479, -0.011529619, -0.011897803, 0.015886465, -0.019759217, 0.014372818, 0.021218317, 0.020631948, -0.005880719, 0.016500104, -0.010234156, -0.0060136747, 0.0028909275, 0.04824576, -0.028909275, -0.027218355, 0.016895562, 0.040172983, -0.015477371, 0.0055568535, 0.014972823, -0.0039443434, -0.002200582, -0.049309403, 0.022772873, -0.020481948, -0.014781912, -0.019377396, -0.0056966273, 0.0022142187, -0.022377415, 0.0026880852, 0.016622832, -0.015068278, 0.017686477, -0.008331872, 0.0015366575, -0.024245609, -0.006917089, 0.007500048, -0.024981977, -0.0036818415, 0.015613736, -0.0038216151, -0.0030630876, 0.00044020166, 0.020959225, -0.012436443, 0.007970505, 0.011297799, 0.012034168, -0.015968284, -0.0143182725, 0.021218317, -0.031200198, -0.023304693, 0.013125083, 0.0011011433, -0.016718289, 0.0016406354, 0.014495547, 0.005393216, 0.053891253, -0.009695516, -0.029263822, 0.012640989, -0.018927393, -0.0034943405, 0.010772795, -0.006664815, 0.020945588, 0.010418248, 0.009531879, 0.0016858062, 0.02308651, -0.019650124, -0.0066818604, -0.01555919, -0.0062216306, 0.018531935, 0.003906843, -0.00914324, -0.014536456, 0.020468311, 0.024927432, 0.012518262, -0.008031869, 0.0047284393, -0.0068864073, -0.010200065, 0.015422826, 0.012606898, -0.027900178, -0.008522782, 0.0170592, 0.009272786, -0.009688698, 0.036818415, 0.0153819155, 0.027491083, 0.004632984, 0.0035522953, 0.024068335, -0.0048273033, -0.027859269, 0.0052193515, 0.029700188, 0.039245702, -0.0061943578, -0.012497807, 0.03872752, -0.02185923, 0.013015992, 0.021654682, 0.0055261715, -0.019622851, -0.005672763, -0.0075886846, -0.007152318, -0.015122823, 0.017645566, 0.0046500294, 0.01640465, 0.01156371, 0.006600042, 0.015477371, -0.001415634, -0.0018187616, 0.008481872, -0.031745657, -0.003542068, 0.0013099515, 0.012327351, 0.010350066, 0.0124841705, 0.019063758, 0.017086472, -0.005481853, 0.018163752, 0.019009212, -0.020604676, -0.015613736, 0.002251719, 0.029563824, 0.015341006, 0.013165993, -0.006204585, -0.0069204983, 0.006576178, 0.012095531, -0.017195564, 0.010145519, 0.006743225, 0.021804685, 0.001008245, -0.029836554, -0.009184149, -0.00034538572, -0.02485925, 0.015913738, 0.0095523335, 0.006269358, 0.040172983, 0.016186466, 0.0014701798, 0.0015835328, 0.010595522, 0.03234566, -0.009047785, 0.0080386875, -0.005369352, -0.009252331, 0.003027292, 0.0082295975, 0.029754734, -0.017372837, -0.027136536, 0.041972995, -0.015504644, -0.0036238867, -0.027245628, -0.025731983, 0.02031831, 0.011379618, 0.020659221, -0.00089403975, -0.0331093, -0.019895582, 0.021231953, 0.008754601, -0.014659184, -0.016254649, 0.004084117, 1.8723485e-05, -0.041945722, -0.022963783, 0.012047804, -0.0067023155, -0.0003321754, -0.009804607, 0.017086472, 0.013268266, -0.0069239074, 0.0055193533, -0.023672877, -0.01824557, 0.016377376, 0.0017267155, -0.008536418, 0.0008224484, -0.0034755904]
