Chapter Number	Chapter Text	Chapter Embedding
1	"I.
HOW MANY KINDS OF PRINCIPALITIES THERE ARE, AND BY WHAT MEANS THEY ARE
ACQUIRED


All states, all powers, that have held and hold rule over men have been
and are either republics or principalities.

Principalities are either hereditary, in which the family has been long
established; or they are new.

The new are either entirely new, as was Milan to Francesco Sforza, or
they are, as it were, members annexed to the hereditary state of the
prince who has acquired them, as was the kingdom of Naples to that of
the King of Spain.

Such dominions thus acquired are either accustomed to live under a
prince, or to live in freedom; and are acquired either by the arms of
the prince himself, or of others, or else by fortune or by ability."	[0.028236944, 0.0050413664, 0.029692456, -0.051022332, -0.024280597, 0.027575348, -0.009917334, -0.0013091343, -0.025577325, -0.02971892, 0.0033774509, -0.0014703985, 0.012193226, 0.026185995, 0.010539235, 0.00979163, 0.036943555, -0.011716876, 0.013959689, 0.009844558, 0.0036453975, 0.0031310061, -0.004538553, -0.015097635, -0.0062322402, 0.0029804928, 0.024624627, -0.017942501, 0.025378847, -0.027681204, 0.0069070687, 0.009249121, -0.0026033828, -0.026066907, -0.015177026, 0.017532311, -0.0008699996, -0.0034336864, -0.017267672, 0.017757254, 0.009507144, 0.0019136682, -0.014277255, -0.022745693, -0.021885617, -0.009890869, -0.019477405, -0.0012256077, -0.014197864, -0.0027026222, 0.018749649, 0.038796026, -0.026410937, -0.01297391, -0.008203798, -0.03231238, -0.019517101, 0.014488966, -0.021594513, 0.0039530396, 0.028739758, 0.02314265, 0.0022593525, -0.008554445, -0.01410524, -0.004565017, -0.021541586, 0.0024098656, -0.033900212, -0.013377484, 0.055203624, 0.019689117, 0.011207447, 0.0020608734, 0.009652695, -0.018604098, -0.011042048, 0.0030565765, -0.023036795, 0.0037677928, -0.015812159, -0.017161816, -0.027019607, -0.0074363463, 0.010076117, -0.013000374, -0.01167718, 0.051525146, -0.0030698085, 0.0009187923, -0.0009427752, -0.0034039146, 0.037922718, 0.00074057473, -0.01664577, 0.01902752, -0.019622955, -0.0019219383, -0.008402277, -0.011948436, -0.00042590284, 0.02383071, -0.03575268, -0.011961667, -0.0027142002, 0.002171691, -0.03088333, -0.018365923, 0.009970261, -0.0050049787, -0.018749649, 0.015044708, 0.035699755, -0.040727887, 0.026066907, -0.016486987, 0.024836337, -0.02066828, -0.009130034, 0.0028812534, 0.0054052444, 0.019781739, -0.008210414, 0.0050413664, 0.019728811, -0.014938852, -0.00969239, -0.014528662, -0.012378473, 0.0025074512, 0.0042507583, -0.0058154343, -0.010453227, -0.0055673355, 0.0054317084, -0.0012322237, -0.011650717, -0.0057360427, -0.0063877157, -0.023671927, 0.027919378, 0.002932527, -0.0014522047, -0.0019467481, -0.00064092176, 0.023539608, -0.0003831058, 0.0042606825, 0.010863417, 0.0067945975, 0.063936695, 0.003989428, 0.020377176, -0.020072842, 0.032841656, 0.0130400695, -0.0010502846, 0.0050115944, -0.006278552, -0.009573303, 0.004942127, 0.03773747, -0.015005012, 0.017016266, -0.011564709, 0.033900212, 0.018193908, 0.005702963, 0.0030053027, 0.02533915, -0.01253064, 0.0092755845, -0.030830404, 0.017095657, 0.010043037, 0.009454216, 0.002563687, 0.013238548, -0.04374477, 0.010737713, -0.0011123093, 0.007469426, 0.035223406, 0.022401663, 0.00030061297, -0.021925312, 0.01822037, 0.014793301, 0.016579611, -0.013364252, -0.010764177, 0.031518463, 0.0094343675, 0.0012570336, -0.6406373, -0.0051935334, -0.011816116, -0.031624317, 0.019517101, 0.01938478, 0.014674214, 0.008256726, -0.02040364, 0.006136309, -0.024412915, -0.0010544197, -0.0015001703, -0.025974283, -0.018246835, -0.012735735, -0.0015985828, -0.02148866, 0.01499178, 0.011928587, -0.0006438162, -0.008342734, -0.0065795784, 0.007310643, 0.012226306, 0.0031971657, 0.0055706436, 0.008984482, 0.012266002, 0.0053159287, -0.036811236, 0.0005139779, 0.025564093, 0.010069501, 0.032338843, -0.0047668037, -0.03218006, 0.021541586, 0.01917307, 0.023380825, -0.005650035, 0.004303686, 0.011630869, 0.01958326, -0.012993758, 0.0039331918, 0.00354285, -0.009665927, 0.009116801, 0.017082425, 0.011458853, -0.0078068404, -0.0011445621, 5.1997362e-05, -0.00039385675, -0.015957711, 0.021620978, -0.007700985, -0.0020757595, -0.0052927732, 0.0050380584, -0.0031095042, -0.016037103, -0.022335501, -0.0012256077, 0.038743097, 0.007873, 0.008494901, 0.016248813, -0.006913685, -0.008256726, 0.030062951, -0.012146914, -0.027548883, 0.008150871, -0.01499178, 0.030406982, 0.029057324, -0.0040423553, -0.0056864233, -2.5520574e-06, -0.0016473756, -0.014541894, 0.009599767, 0.01663254, -0.0005172859, -0.0346412, 0.011035432, -0.011769804, -0.00023900178, 0.0033840667, 0.005468096, -0.0036321655, -0.006119769, -0.017148584, 0.037816864, -0.0020922993, -0.0059775254, -0.008164102, -0.02662265, -0.018511474, -0.009970261, 0.008997714, 0.019543564, 0.029401354, -0.010618626, -0.0040423553, 0.0027191623, 0.041918762, -0.030565765, 0.018035125, -0.0016663965, 0.016711932, 0.031042114, 0.008838931, -0.032894585, 0.023923334, -0.012735735, -0.015296114, -0.02061535, 0.024201205, 0.02260014, 0.0031822799, -0.04403587, 0.0063380958, 0.044671003, -0.016367901, 0.0036817852, -0.01074433, 0.0071717077, 0.014528662, -0.0038174125, 0.010605394, 0.0060006813, 0.014965315, 0.009249121, 0.020575656, -0.020139001, 0.0071121636, -0.016566379, -0.0008013589, -0.032841656, 0.0003700806, -0.005712887, -0.02506128, -0.038716637, -0.031200897, -0.013185621, -0.02465109, -0.00272247, 0.009255737, -0.008885243, -0.01710889, 0.002165075, -0.009738702, 0.0055706436, -0.0102349, 0.0025206832, -0.0014298757, -0.0077539124, 0.004283838, 0.015904782, -0.03744637, 0.009130034, 0.013628891, -0.024915729, 0.0074363463, 0.01710889, -0.0016639156, -0.04737032, 0.00354285, 0.023301434, -0.018643793, 0.009831326, 0.001768117, 0.006225624, -0.011372847, -0.0031740097, 0.009818094, 0.021951776, 0.004710568, -0.0462853, -0.032153595, 0.015640145, 0.021276947, -0.0017085733, 0.012272618, -0.00433015, 0.008269958, 0.023539608, -0.019728811, 0.018815808, -0.0057856627, -0.0061528487, 0.00024189627, 0.008342734, 0.014356647, 0.013000374, -0.014078776, 0.012616647, 0.01615619, 0.010122429, 0.017148584, -0.008111175, 0.0077142166, -0.025312686, -0.013139309, -0.009454216, 0.033714965, 0.0004676661, 0.012133682, -0.01533581, 0.004571633, -0.039219446, -0.007654673, 0.044221118, 0.0056070313, 0.0052431533, -0.014952084, 0.0022196567, 0.012927598, 0.005163762, -0.0067615174, 0.008713228, -0.031174432, -0.0073437225, 0.0052133813, 0.00278036, -0.005947754, -0.03252409, -0.025312686, 0.008263342, 0.020099306, -0.009553456, -0.0053159287, 0.049725603, 0.0034072227, -0.0022940864, 0.0073834183, -0.016513452, 0.020549191, -0.0010072809, -0.0042242943, -0.0032550555, 0.01622235, -0.026728503, 0.030698083, 0.002178307, -0.01882904, 0.027085766, -0.00077448157, -0.0125174085, 0.0017300752, -0.0039761956, 0.024796642, -0.021806225, -0.0026116527, 0.019001056, 0.007270947, 0.023367593, 0.002950721, -0.006920301, 0.018948128, -0.024333524, 0.006913685, 0.006430719, 0.013946457, -0.00061569834, -0.005951062, -0.016685467, -0.011928587, 0.011240527, 0.028184017, 0.0061925445, 0.010936192, -0.014224327, -0.0060072974, -0.02307649, 0.0251936, 0.021012308, -0.048772905, -0.036731847, 0.016486987, 0.028448654, 0.0067549017, -0.041177776, -0.029692456, -0.008997714, -0.033132758, 0.009024178, -0.0056136474, -0.012001363, -0.0054217842, -0.015150563, -0.012543872, -0.013033453, 0.016963338, 0.004588173, 0.026238922, -0.01458159, 0.019398013, -0.023023563, -0.0147139095, 0.01328486, 0.042368647, 0.011280223, -0.027231317, -0.0068607572, -0.021792993, -0.02717839, -0.022004703, -0.0141714, -0.02697991, -0.010261363, 0.014343415, 0.012358625, -0.024928961, 0.010049653, 0.038848955, -0.02129018, -0.0065564224, -0.020522727, -0.008078095, 0.0023453601, 0.08584878, 0.0066325064, -0.019662652, 0.027151925, -0.03895481, -0.0053423927, 0.007820073, 0.0001328362, 0.027813522, 0.0034138386, 0.0065431907, 0.0030416904, 0.01950387, 0.032206524, 0.03958994, -0.007906079, -0.01650022, -0.036467206, -0.03141261, 0.005081062, 0.0032269375, 0.0051935334, 0.022163488, 0.025841964, -0.019345086, 0.005881594, 0.020165466, 0.035593897, -0.0051736855, 0.0059808334, -0.012967294, 0.0047899596, 0.004915663, 0.019808203, -0.0040092757, 0.005282849, -0.0006326518, 0.025431775, 0.00079143496, -0.01807482, 0.020324249, -0.00017428937, -0.0012677845, -0.024796642, 0.01800866, -0.02225611, 0.0044426215, -0.01139931, 0.014184631, -0.02260014, 0.010162124, -0.007588513, 0.005540872, -0.0044657774, 0.021594513, 0.010181972, 0.017651398, 0.014025848, -0.01287467, -0.003714865, -0.014938852, -0.021250485, 0.019265695, -0.019133374, 0.0044393134, -0.029771848, -0.008269958, -0.0044161575, -0.03231238, -0.009090338, 0.006688742, -0.031095041, -0.011796268, -0.01567984, 0.014885924, 0.0188952, 0.000170878, -0.015375506, 0.016672235, 0.0101158125, -0.00041453165, -0.038213823, -0.0067482856, -0.030724548, -0.020681512, 0.011326535, -0.022705996, -0.0003045412, -0.004105207, -0.0044889334, -0.007952391, -0.0031293521, 0.014568358, -0.005375473, -0.009566687, 0.00046435813, -0.010148892, -0.006245472, -0.010294444, -0.0044856253, 0.0136685865, -0.011597789, -0.0075620497, -0.024399683, 0.016473755, -0.0011114824, -0.015044708, 0.000588821, -0.019411245, -0.0055507957, -0.005924598, -0.03223299, 0.02320881, 0.0016779745, -0.011247143, 0.0024445995, 0.013086381, 0.020363944, 0.015534289, -0.006801213, -0.010929576, -0.0018342767, 0.032153595, 0.011498549, -0.0547802, 0.006900453, -0.014594821, 0.027681204, -0.022772156, 0.003172356, 0.0014885925, 0.010664938, -0.0022180027, -0.0075951293, -0.023261737, -0.00028241906, -0.040648498, -0.008375813, -0.04054264, 0.011538245, 0.015481361, -0.014462503, -0.016447293, -0.01710889, -0.010473074, -0.027416565, -0.0062190085, 0.0045584007, -0.008819083, 0.005487944, -0.007641441, -0.011326535, -0.0032302456, -0.00477342, 0.021766528, -0.032682873, -0.005110834, -0.029665994, 0.011802884, 0.0018458546, 0.023380825, 0.01061201, 0.0030631924, 0.021620978, -0.012444633, 0.015243187, -0.0166987, -0.002558725, -0.008263342, 0.0034766903, 0.0071849395, 0.013437028, 0.011128055, -0.006847525, 0.022613373, 0.03924591, 0.002351976, -0.03532926, -0.023407288, -0.036731847, 0.0009882599, 0.0039596558, -0.0022246186, 0.014369879, -0.028157553, 0.0036288574, 0.026027212, -0.012232922, -0.0031310061, -0.005322545, 0.010982504, -0.005650035, 0.04840241, 0.016486987, 0.007892848, 0.007515738, 0.008786003, 0.0042540664, -0.0065895026, 0.011392694, -0.023380825, 0.036255494, -0.014780069, -0.01725444, -0.02260014, -0.0019550181, 0.015203491, -0.011134671, 0.008005319, -0.0058418983, -0.01376121, -0.012841591, -0.000499092, -0.023711624, -0.0035990856, -0.006139617, -0.0067549017, 0.008164102, -0.017902805, -0.038690172, -8.9832414e-05, -0.012226306, 0.036176104, 0.0039530396, 0.010638474, 0.010770793, -0.022970635, -0.018564401, 0.008375813, -0.003354295, -0.008329501, 0.039034203, -0.020086074, -0.003939808, -0.018842272, 0.017161816, -0.02218995, -0.011352998, -0.02136957, 0.02184592, 0.01684425, 0.010109196, 0.00749589, 0.008653684, 0.010274596, 0.002583535, 0.0035726218, -0.002166729, -0.01218661, -0.008991098, -0.031253826, -0.0003607769, -0.018365923, 0.01057893, -0.0026678883, -0.001758193, 0.005375473, -0.01950387, -0.0016482027, 0.012669575, -0.030856866, -0.005372165, 0.011081744, 0.0011147903, 0.018908432, 0.0063281716, -0.018114517, -0.0031773178, -0.010916345, 0.027760595, -0.009910718, -0.010486307, 0.011088359, 0.041124847, -0.01628851, 0.009626231, -0.0046741804, -0.0127291195, 0.00038724078, -0.008772771, 0.024915729, 0.01986113, -0.0020956073, -0.017280905, -0.013476724, -0.0035560818, -0.009652695, -0.006913685, 0.011597789, 0.00783992, -0.022573678, -0.0063314796, -0.008183951, 0.0016515106, 0.00046394463, -0.012887903, -0.003159124, 0.018723184, 0.014674214, 0.014766837, -0.0023222042, 0.0057856627, -0.0034833062, 0.013020222, -0.015984174, -0.0132517805, 0.048164234, -0.018643793, -0.011974899, -0.0017482691, 0.021475427, 0.0077803764, -0.0046444084, 0.008977867, 0.003331139, 0.014237559, 0.014899156, -0.016725162, -0.0077803764, 0.001171026, 0.024386453, 0.008150871, -0.0031558159, -0.024280597, 0.0015522711, -0.0022163487, 0.007065852, 0.016526684, -0.017929269, -0.0034072227, -0.013357636, 0.0038901882, -0.034270704, 0.019477405, 0.0060536093, -0.007820073, -0.0017482691, 0.004174675, -0.014740373, -0.017148584, 0.008481669, 0.021766528, 0.02889854, -0.0065696547, -0.010347371, -0.00083237124, 0.004479009, -0.0017416531, -0.049857922, -0.012610032, -0.015957711, 0.059808336, -0.0019500561, -0.010400299, 0.00077985704, 0.0036520134, -0.022679532, 0.0036553214, 0.007264331, 0.023632232, 0.027919378, 0.018551169, 0.0026860824, -0.0030499604, 0.0009899139, 0.008137639, -0.025590558, 0.0059609856, 0.0030714623, 0.009672543, -0.0012264347, -0.0021832688, -0.02773413, 0.01328486, 0.017479382, -0.028316336, 0.016407596, 0.004131671, 0.0047238, -0.0070923157, -0.017175049, 0.019371549, 0.015005012, 0.017585238, 0.012431401, -0.04086021, -0.0005850995, -0.013403947, 0.017161816, -0.02061535, -6.9312584e-05, 0.0060039894, -0.008613988, 0.027337173, 0.00890509, -0.004842887, 0.020218393, 0.0023966338, 0.03607025, 0.011392694, 0.0038703403, 0.0042739143, -0.009937181, -0.017227976, -0.024836337, -0.005256385, -0.0024164817, 0.012305697, -0.012702655, -0.012193226, 0.027919378, -0.0061892364, 0.008673532, -0.032497626, 0.003747945, 0.01310623, 0.0018458546, -0.0030367286, 0.01781018, 0.026953448, -0.016659003, -0.0133841, -0.0029838008, -0.009937181, 0.007125396, -0.03088333, 0.0039530396, -0.0042772223, 0.020178698, 0.014316951, -0.011478702, 0.006437335, -0.0020095997, 0.0012810165, -0.011716876, -0.0020989154, 0.19921997, -0.005557412, -0.001994714, 0.014568358, -0.005676499, -0.012702655, 0.007654673, 0.004882583, -0.0046510245, -0.0065431907, -0.020191928, 0.008620604, -0.01133315, 0.015031476, 0.010598778, -0.032285914, -0.01499178, -0.028713293, 0.019067215, -0.004267298, -4.248691e-05, -0.0131459255, -0.002581881, -0.008104559, 0.03032759, -0.0075488174, -0.02307649, 0.0071849395, 0.0046708724, 0.0026397705, 0.009123418, 0.004098591, 0.024108581, 0.020178698, -0.024664322, 0.008719844, 0.02499512, -0.008461821, -0.00746281, -0.0075091217, 0.04099253, -0.0039365, -0.012649728, -0.006046993, 0.020840295, 0.046047125, -0.010122429, -0.012848207, -0.035223406, -0.011703644, -0.037075873, 0.004737032, 0.010195204, 0.023235274, 0.007820073, -0.010492923, 0.00046229066, 0.0462853, -0.018432083, 0.0011429082, -0.0080251675, 0.01725444, -0.01061201, 0.016460525, 0.019225998, 0.03334447, -0.012940831, -0.0066027343, 0.0038637244, -0.028184017, -0.01746615, -0.004846195, 0.008256726, -0.0070261564, 0.01167718, -0.015349042, 0.059543695, 0.028845614, 0.0028795993, -0.028395727, -0.00067648257, -0.016354669, -0.011611021, -0.006473723, -0.008653684, -0.033106297, 0.0133841, 0.0018293146, -0.029004397, 0.0035031543, -0.010228284, -0.008739691, 0.0074826577, 0.008620604, 0.002560379, -0.010294444, -0.0037082492, 0.015362274, 0.0030416904, -0.023777783, -0.0012628225, 0.063883774, 0.035064623, 0.004842887, -0.009480679, 0.0019401321, 0.0054383245, 0.029189643, 0.0074363463, 0.00055739516, 0.0046113287, -0.003159124, 0.0048296554, -0.028951468, 0.023129418, 0.001170199, -0.0044426215, -0.03212713, 0.013867065, 0.010539235, -0.016275277, -0.010552466, -0.0031177741, -0.0009601421, -0.008415509, -0.0041680587, -0.0368377, 0.027628275, 0.009831326, -0.0117367245, 0.021647442, -0.02717839, 0.03130675, 0.0166987, -0.00595437, 0.013026837, 0.006496879, 0.009440984, 0.005878286, -0.012821742, 0.0033609108, -0.004128363, 0.025352383, 0.006291784, -0.0053688567, -0.013364252, 0.0076215933, -0.01540197, -0.011273607, -0.0079193115, -0.027151925, -0.018088052, -0.0067416695, -0.042209864, 0.010995736, 0.006434027, -0.010274596, -0.031968348, 0.0025074512, 0.021660674, -0.021343106, 0.0022097328, 0.02422767, -0.0034899223, -0.014965315, -0.018762881, -0.16651064, 0.028925005, 0.019781739, -0.0047238, 0.04175998, 0.003144238, 0.024492307, 0.0028680214, -0.00030350746, -0.021819457, 0.030512836, 0.00862722, -0.014674214, -0.018524706, 0.008713228, -0.016539916, -0.010850185, 0.0041680587, 0.015441665, 0.007833304, 0.012801895, 0.009943797, 0.0032203216, -0.028395727, 0.011214063, -0.00055987615, -0.005090986, -0.012074139, -0.0137215145, -0.01841885, 0.0063116318, -0.020509496, 0.017929269, 0.018088052, 0.0055772597, 0.006324864, 0.0012818435, 0.0060337614, 0.0032930973, 0.011928587, 0.017558774, -0.002932527, 0.01485946, -0.01704273, 0.015005012, -0.002158459, 0.010956041, 0.0063711754, 0.041839372, -0.034879375, 0.0016308357, -0.0019384781, -0.0005673191, 0.001781349, 0.047555566, 0.01376121, -0.0065630386, 0.022745693, 0.002176653, -0.005104218, 0.011088359, 0.004902431, 0.033238616, 0.0095931515, 0.014131704, -0.017003033, -0.015097635, 0.022123791, -0.041442413, 0.009401288, -0.02225611, -0.00506783, -0.00017883784, -0.026688809, 0.004918971, 0.009374824, -0.015177026, -0.012722503, -0.0108435685, 0.01533581, -0.031121505, 0.022269342, -0.0035593899, -0.021925312, -0.00954684, 0.019080447, -0.016394364, -0.0057691224, -0.014316951, -0.026146298, -0.012385089, -0.028395727, -0.025722876, -0.028131088, -0.0033708347, 0.021713601, 0.023089722, -0.023499912, -0.0008873665, -0.0007066679, 0.003336101, 0.008084711, -0.03403253, 0.008799235, 0.0146609815, -0.007449578, 0.03130675, 0.0118095, 0.03183603, -0.008382429, 0.0071386276, 0.01904075, 0.0031425839, 0.025445007, 0.007925928, 0.033026904, 0.0054217842, -0.0028399036, 0.011604405, -0.0011635831, 0.03855785, 0.004571633, 0.016685467, 0.010307675, 0.0073304907, -0.007251099, -0.12744997, -0.0065928106, -0.010175357, 0.025021585, -0.012755583, 0.021528354, 0.0011313303, -0.015282882, -0.020575656, 0.023195578, 0.009520375, -0.03628196, 0.010790641, 0.010916345, 0.017227976, -0.0090175625, 0.013456875, -0.01190874, 0.007681137, 0.025643485, -0.008018551, -0.0044426215, -0.024254132, -0.029242571, 0.009897485, -3.1335387e-07, -0.032021277, 0.0029904167, 0.021647442, 0.006060225, 0.0069666123, -0.0071320115, 0.0054350165, 0.0038670322, 0.003342717, 0.008779387, 0.0029209491, -0.0077406806, 0.022269342, -0.025114208, 0.0028829074, -0.0009063874, 0.022613373, -0.02402919, 0.022348734, 0.0033906826, -0.0057558906, -0.018657025, 0.02860744, -0.02752242, -0.025034817, -0.024664322, -0.0127291195, -0.004353306, -0.0036520134, -0.020575656, -0.004353306, 0.018590866, -0.0035031543, 0.0018971283, -0.006523343, 0.011458853, -0.009751935, 0.014952084, 0.023605768, -0.0038207206, -0.030406982, -0.021872384, -0.0017945808, -0.014436038, -0.015110867, 0.009030794, -0.025802268, 0.0082831895, -0.03972226, -0.021276947, -0.03231238, -0.018458545, 0.0396958, -0.04003983, -0.023976263, -0.0021981548, 0.013470108, -0.024399683, 0.01943771, 0.0127291195, 0.027098998, -0.0026993142, 0.008991098, -0.019940522, -0.016619308, 0.0030582305, 0.031253826, -0.027363637, -0.007879616, 0.0127291195, 0.02102554, -0.001389353, -0.006731746, 0.029216107, -0.025736108, -0.030168807, -0.047423247, 0.027443029, -0.022772156, -0.02773413, 0.002131995, -0.0037644848, 0.014356647, -0.026053675, -0.010016573, 0.008508133, -0.014224327, 0.021462195, -0.01841885, -0.0013306362, -0.026371242, -0.013079765, 0.0034138386, 0.016341437, -0.026543258, 0.03218006, 0.0016192577, 0.0173206, 0.036652453, -2.1540656e-05, -0.011902124, 0.029665994, -0.0088587785, 0.024293829, -0.004932203, -0.011802884, 0.014224327, -0.0380815, -0.0077340645, 0.022110559, -0.015719537, -0.012457864, -0.016116494, 0.020774134, 0.026807895, 0.0664243, 0.003731405, -0.043294884, -0.009321896, -0.023698391, -0.0089646345, 0.019133374, -0.0146609815, 0.019477405, -0.011247143, 0.009216041, 0.031386144, 0.0182733, -0.0051869177, -0.023857174, -0.019464172, -0.011280223, 0.03562036, 0.0045087812, 0.0010908075, -0.03247116, 0.029877704, -0.0015125753, 0.01663254, 0.0012760545, 0.009553456, -0.023460217, -0.027337173, 0.0146609815, -0.0054250923, -0.03347679, -0.001986444, 0.0034237625, -0.0007720006, 0.0009708931, 0.027707666, -0.0046940283, 0.021859152, 0.010036421, -0.014832997, 0.030142343, 0.00900433, -0.02566995, -0.022626605, 0.022891244, 0.03519694, -0.013357636, -0.010439995, 0.016738394, -0.02717839, -0.0077803764, 0.033238616, 0.001974866, -0.002533915, -0.021541586, -0.0034403026, -0.012748967, -0.014766837, 0.0034833062, 0.0069467644, 0.012940831, -0.005441632, -0.0030896564, 0.0054780203, -0.027469492, -0.002955683, 0.017916037, -0.024836337, -0.027681204, -0.019689117, 0.014118472, 0.013489955, 0.034667663, 0.012371857, -0.002734048, -0.010929576, 0.0025041432, 0.0010527656, 0.006596118, -0.02381748, 0.026860824, 0.010406915, 0.0075620497, 0.009553456, -0.010453227, 0.012643112, 0.027363637, -0.004912355, -0.019464172, 0.012980526, 0.018776113, 0.01290775, 0.008845547, -0.024055654, -0.013331172, -0.016301742, -0.02020516, -0.0016548185, 0.011895508, -0.0346412, 0.05327176, 0.015904782, 0.006649046, 0.010062885, 0.02107847, 0.035646826, 0.00032170137, 0.0022014629, -0.017347064, -0.019966986, -0.004548477, 0.006827677, 0.0125703355, -0.022917707, -0.022719229, 0.030486373, -0.017347064, -0.016381133, -0.021753298, -0.017585238, 0.02547147, 0.018961359, 0.021237252, 0.0008815775, -0.023724856, -0.024730481, 0.044274047, -0.0054250923, 0.016817786, -0.010248132, 0.019596493, 0.00793916, -0.045914806, -0.017823413, 0.008852163, -0.014356647, -0.01643406, -0.0057492745, 0.010095964, 0.01499178, 0.0024495616, -0.008236878, -0.024002725, -0.0051339897, 0.017479382, -0.0030780784, -0.0026149608, 0.0047800355, 0.004684104]
